Title,Category,"Price(""$"")",7-day sales,Total Sales,Total Reviews,7-day Reviews,Total Favorites,7-day Favorites,Tags,Ship From,Release Time,Best Seller,Etsy Pick,Raving,Store Name,Product URL,Image URL
"Custom Chinese Mini seal pendant,Custom Japanese Name Chop Free Chinese Name Translation Stamp. ",Craft Supplies & Tools,31.99,False,1,0,False,12,False,"Craft Supplies & Tools,Stamps & Seals,Stamps,name seal,custom seal,personalized seal,personal seal,stone seal stamp,personal name stamp,dragon carving,Chinese culture,Calligraphy seal,painting,calligraphy brush,asian decor,brush set",,2021-12-26,False,False,False,SealCuttingArts,https://www.etsy.com/listing/1148101973/custom-chinese-mini-seal-pendantcustom,
"Chinese Customized couple seal, Personal Name Stamp,Custom Chinese Chop Free Chinese Name Translation Seal. ",Craft Supplies & Tools,40.99,False,1,0,False,9,False,"Craft Supplies & Tools,Stamps & Seals,Stamps,name seal,custom seal,personalized seal,personal seal,stone seal stamp,personal name stamp,dragon carving,Chinese culture,Calligraphy seal,painting,calligraphy brush,asian decor,brush set",,,False,False,False,SealCuttingArts,https://www.etsy.com/listing/1318819365/chinese-customized-couple-seal-personal,
Boy Reader Black Hair Personalized Book Labels (12 Pack) 2.5 ,"Books, Movies & Music > Books > Book Accessories > Bookplates, Stamps & Embossers",6,False,7,0,False,6,False,"Books, Movies & Music,Books,Book Accessories,Bookplates, Stamps, & Embossers,baby shower ideas,party favors seals,baby's first library,this book belongs to,personalized name,book birthday party,from the classroom,back to school club,custom bookplate,bookmark stickers,1st stock plate,teacher student kids,asian brunette child",United States,2019-02-15,False,False,False,RainingParties,https://www.etsy.com/listing/683224217/boy-reader-black-hair-personalized-book,Upgrade Pro to Unlock
Foldable hand fan. Purple bindweed and calligraphy in Chinese painting on paper. Painter 罗耐心 Luō Nàixīn Unique numbered work. ,Accessories > Hand Fans,40.25,False,0,0,False,5,False,"Fan,Manual Fan,Chinese Painting,Chinese Decoration,Calligraphy,Chinese Ink,Personalized Gift,Chinese Art,Folding Fan,Asian Art,Bindweed,Chinese Seals,Chinese First Name,Gifts for Girlfriend,Gifts for Mom,Birthday Gifts,Gifts for Her,Gifts",French,2023-04-21,False,False,False,CreaDina,https://www.etsy.com/listing/1466278411/foldable-hand-fan-purple-bindweed-and,Upgrade Pro to Unlock
"Chinese Calligraphy Seal, Personal Name Stamp,Custom Chinese Chop Free Chinese Name Translation Seal（2CM）. ",Craft Supplies & Tools,33.99,False,0,0,False,0,False,"Craft Supplies & Tools,Stamps & Seals,Stamps,name seal,custom seal,personalized seal,personal seal,stone seal stamp,personal name stamp,dragon carving,Chinese culture,Calligraphy seal,painting,calligraphy brush,asian decor,brush set",,,False,False,False,SealCuttingArts,https://www.etsy.com/listing/1254300255/chinese-calligraphy-seal-personal-name,
"Chinese Qingtian stone Seal, Personal Name Stamp,Custom Chinese Chop Free Chinese Name Translation Seal. ",Craft Supplies & Tools,29.99,False,0,0,False,2,False,"Craft Supplies & Tools,Stamps & Seals,Stamps,name seal,custom seal,personalized seal,personal seal,stone seal stamp,personal name stamp,dragon carving,Chinese culture,Calligraphy seal,painting,calligraphy brush,asian decor,brush set",,2020-09-27,False,False,False,SealCuttingArts,https://www.etsy.com/listing/863452672/chinese-qingtian-stone-seal-personal,
Chinese Luck Rabbit Customized Copper Name Stamp Personal Calligraphy Chapter Stamps Portable Retro Square Chop Decoration. ,Craft Supplies & Tools,38.99,False,0,0,False,0,False,"Craft Supplies & Tools,Stamps & Seals,Stamps,name seal,custom seal,personalized seal,personal seal,stone seal stamp,personal name stamp,dragon carving,Chinese culture,Calligraphy seal,painting,calligraphy brush,asian decor,brush set",,,False,False,False,SealCuttingArts,https://www.etsy.com/listing/1523624037/chinese-luck-rabbit-customized-copper,
"China Dragon turtle seal，Chinese Name Seal, Personal Personalized  Chinese Chop Free Chinese Name Translation Seal. ",Craft Supplies & Tools,119.99,False,0,0,False,4,False,"Craft Supplies & Tools,Stamps & Seals,Stamps,name seal,custom seal,personalized seal,personal seal,stone seal stamp,personal name stamp,dragon carving,Chinese culture,Calligraphy seal,painting,calligraphy brush,asian decor,brush set",United States,,False,False,False,SealCuttingArts,https://www.etsy.com/listing/1138016668/china-dragon-turtle-sealchinese-name,Upgrade Pro to Unlock
"Custom Graduation Commemorative Seal, Personal Name Stamp,Custom Chinese Chop Free Chinese Name Translation Seal. ",Craft Supplies & Tools,33.99,False,4,0,False,38,False,"Craft Supplies & Tools,Stamps & Seals,Stamps,name seal,custom seal,personalized seal,personal seal,stone seal stamp,personal name stamp,dragon carving,Chinese culture,Calligraphy seal,painting,calligraphy brush,asian decor,brush set",United States,2022-07-17,False,False,False,SealCuttingArts,https://www.etsy.com/listing/1255708502/custom-graduation-commemorative-seal,Upgrade Pro to Unlock
"Chinese Shoushan stone Stone Seal, Personal Name Stamp,Custom Chinese Chop Free Chinese Name Translation Seal. ",Craft Supplies & Tools,34.99,False,0,0,False,2,False,"Craft Supplies & Tools,Stamps & Seals,Stamps,name seal,custom seal,personalized seal,personal seal,stone seal stamp,personal name stamp,dragon carving,Chinese culture,Calligraphy seal,painting,calligraphy brush,asian decor,brush set",United States,,False,False,False,SealCuttingArts,https://www.etsy.com/listing/1011945406/chinese-shoushan-stone-stone-seal,Upgrade Pro to Unlock
"Chinese Shoushan Stone Calligraphy Seal, Personal Name Stamp,Custom Chinese Chop Free Chinese Name Translation Seal. ",Craft Supplies & Tools,24.99,False,0,0,False,2,False,"Craft Supplies & Tools,Stamps & Seals,Stamps,name seal,custom seal,personalized seal,personal seal,stone seal stamp,personal name stamp,dragon carving,Chinese culture,Calligraphy seal,painting,calligraphy brush,asian decor,brush set",,,False,False,False,SealCuttingArts,https://www.etsy.com/listing/1271324476/chinese-shoushan-stone-calligraphy-seal,
Chinese style Ceramic Pen Holder For Desk Cute Stand Pencil Cup Pot Desk Organizer For Kids Makeup Brush Holder ,Craft Supplies & Tools,28.99,False,1,0,False,7,False,"Craft Supplies & Tools,Stamps & Seals,Stamps,name seal,custom seal,personalized seal,personal seal,stone seal stamp,personal name stamp,dragon carving,Chinese culture,Calligraphy seal,painting,calligraphy brush,asian decor,brush set",,2022-05-17,False,False,False,SealCuttingArts,https://www.etsy.com/listing/1220633944/chinese-style-ceramic-pen-holder-for,
Small Buddha statue monk figurine tathagata India Yoga Mandala tea pet purple ceramic crafts decorative ceramic ornaments monk. ,Craft Supplies & Tools,12.99,False,5,0,False,11,False,"Craft Supplies & Tools,Stamps & Seals,Stamps,name seal,custom seal,personalized seal,personal seal,stone seal stamp,personal name stamp,dragon carving,Chinese culture,Calligraphy seal,painting,calligraphy brush,asian decor,brush set",,2021-08-22,False,False,False,SealCuttingArts,https://www.etsy.com/listing/1057945944/small-buddha-statue-monk-figurine,
"Chinese Natural Red Stone Seal, Personal Name Stamp,Custom Chinese Chop Free Chinese Name Translation Seal. ",Craft Supplies & Tools,39.99,False,0,0,False,0,False,"Craft Supplies & Tools,Stamps & Seals,Stamps,name seal,custom seal,personalized seal,personal seal,stone seal stamp,personal name stamp,dragon carving,Chinese culture,Calligraphy seal,painting,calligraphy brush,asian decor,brush set",,,False,False,False,SealCuttingArts,https://www.etsy.com/listing/1282980348/chinese-natural-red-stone-seal-personal,
"Chinese Wood and stone Seal, Personal Name Stamp,Custom Chinese Chop Free Chinese Name Translation Seal. ",Craft Supplies & Tools,37.99,False,1,0,False,4,False,"Craft Supplies & Tools,Stamps & Seals,Stamps,name seal,custom seal,personalized seal,personal seal,stone seal stamp,personal name stamp,dragon carving,Chinese culture,Calligraphy seal,painting,calligraphy brush,asian decor,brush set",,2021-05-15,False,False,False,SealCuttingArts,https://www.etsy.com/listing/1019621287/chinese-wood-and-stone-seal-personal,
"Chinese Qintian Stone Seal, Personal Name Stamp,Custom Chinese Chop Free Chinese Name Translation Seal（1.5CM）. ",Craft Supplies & Tools,31.99,False,1,0,False,16,False,"Craft Supplies & Tools,Stamps & Seals,Stamps,name seal,custom seal,personalized seal,personal seal,stone seal stamp,personal name stamp,dragon carving,Chinese culture,Calligraphy seal,painting,calligraphy brush,asian decor,brush set",,2020-11-25,False,False,False,SealCuttingArts,https://www.etsy.com/listing/897346826/chinese-qintian-stone-seal-personal-name,
"Chinese Qingtian stone Seal, Personal Name Stamp,Custom Chinese Chop Free Chinese Name Translation Seal. ",Craft Supplies & Tools,25.99,False,0,0,False,2,False,"Craft Supplies & Tools,Stamps & Seals,Stamps,name seal,custom seal,personalized seal,personal seal,stone seal stamp,personal name stamp,dragon carving,Chinese culture,Calligraphy seal,painting,calligraphy brush,asian decor,brush set",,,False,False,False,SealCuttingArts,https://www.etsy.com/listing/1243947441/chinese-qingtian-stone-seal-personal,
"Chinese Auspicious dragon Stone Seal, Personal Name Stamp,Custom Chinese Chop Free Chinese Name Translation Seal（2.5CM）. ",Craft Supplies & Tools,29.99,False,1,0,False,11,False,"Craft Supplies & Tools,Stamps & Seals,Stamps,name seal,custom seal,personalized seal,personal seal,stone seal stamp,personal name stamp,dragon carving,Chinese culture,Calligraphy seal,painting,calligraphy brush,asian decor,brush set",,2020-08-10,False,False,False,SealCuttingArts,https://www.etsy.com/listing/838173192/chinese-auspicious-dragon-stone-seal,
"Chinese Auspicious Clouds Seal, Personal Name Stamp,Custom Chinese Chop Free Chinese Name Translation Seal. ",Craft Supplies & Tools,49.99,False,0,0,False,0,False,"Craft Supplies & Tools,Stamps & Seals,Stamps,name seal,custom seal,personalized seal,personal seal,stone seal stamp,personal name stamp,dragon carving,Chinese culture,Calligraphy seal,painting,calligraphy brush,asian decor,brush set",,,False,False,False,SealCuttingArts,https://www.etsy.com/listing/1442728616/chinese-auspicious-clouds-seal-personal,
"Chinese Calligraphy Stone Seal, Personal Name Stamp,Custom Chinese Chop Free Chinese Name Translation Seal Monkey Engraving（2.5CM） ",Craft Supplies & Tools,25.99,False,1,0,False,11,False,"Craft Supplies & Tools,Stamps & Seals,Stamps,name seal,custom seal,personalized seal,personal seal,stone seal stamp,personal name stamp,dragon carving,Chinese culture,Calligraphy seal,painting,calligraphy brush,asian decor,brush set",,2020-07-30,False,False,False,SealCuttingArts,https://www.etsy.com/listing/833100316/chinese-calligraphy-stone-seal-personal,
Hand fan. Peony and calligraphy in Chinese painting on paper. Painter 罗耐心 Luō Nàixīn Unique numbered work. Greeting card ,Accessories > Hand Fans,35.98,False,0,0,False,0,False,"Fan,Manual Fan,Chinese Painting,Chinese Decoration,Calligraphy,Chinese Seals,Chinese Ink,Personalized Gift,Chinese Art,Asian Art,Bindweed,Birthday,Chinese First Name,Gifts for Girlfriend,Gifts for Mom,Birthday Gifts,Gifts for Her,Gifts",French,,False,False,False,CreaDina,https://www.etsy.com/listing/1555808334/hand-fan-peony-and-calligraphy-in,Upgrade Pro to Unlock
"Chinese Brass Fenghou  Seal, Personal Name Stamp,Custom Chinese Chop Free Chinese Name Translation Seal. ",Craft Supplies & Tools,29.99,False,0,0,False,4,False,"Craft Supplies & Tools,Stamps & Seals,Stamps,name seal,custom seal,personalized seal,personal seal,stone seal stamp,personal name stamp,dragon carving,Chinese culture,Calligraphy seal,painting,calligraphy brush,asian decor,brush set",,2022-03-23,False,False,False,SealCuttingArts,https://www.etsy.com/listing/1187629334/chinese-brass-fenghou-seal-personal-name,
Chinese Jindezhen Ceramic Round Pen Holder Stand for Desk Cute Pencil Cup Pot Desk Organizer Makeup Brush Holder. ,Craft Supplies & Tools,23.99,False,0,0,False,0,False,"Craft Supplies & Tools,Stamps & Seals,Stamps,name seal,custom seal,personalized seal,personal seal,stone seal stamp,personal name stamp,dragon carving,Chinese culture,Calligraphy seal,painting,calligraphy brush,asian decor,brush set",,2022-10-27,False,False,False,SealCuttingArts,https://www.etsy.com/listing/1333883387/chinese-jindezhen-ceramic-round-pen,
Girl Reader Black Hair Personalized Book Labels (12 Pack) 2.5 ,"Books, Movies & Music > Books > Book Accessories > Bookplates, Stamps & Embossers",6,False,4,0,False,5,False,"Baby Shower Ideas,This Book Belongs To,Personalized Name,Book Birthday Party,Custom Bookplate,Bookmark Stickers,Party Favors Seals,Baby's First Library,From the Classroom,Back to School Club,1st Stock Plate,Teacher Student Kids,Asian Brunette Child,Gifts for Boys,Gifts for Girls,Birthday Gifts,Gifts for Teachers,Personalized Gifts,Gifts",United States,,False,False,False,RainingParties,https://www.etsy.com/listing/683227943/girl-reader-black-hair-personalized-book,Upgrade Pro to Unlock
Custom Chinese Name Seal / Stone Seal Carving / Your Name Custom Engraved on a Chinese Chop / Square 1 X 1 X 5 CM ,Craft Supplies & Tools,25.95,False,93,17,False,105,False,"Chinese Name Stamp,Chinese Name Chop,Chinese Name Seal,Stone Seal Carving,Chinese Carving,Chinese Stone Seal,Asian Name Seals,Custom Name Stamp,Custom Name Seal,Custom Name Chop,Custom Asian Stamp,Chinese Engraving,Stamp Chop Seal,Gifts for Teachers,Personalized Gifts,Gifts",United States,2020-10-08,False,False,False,CalligraphyforGod,https://www.etsy.com/listing/777537338/custom-chinese-name-seal-stone-seal,Upgrade Pro to Unlock
Unique Asian Name Seal / Cool Gift For Him / Name in Chinese On A Custom Porcelain Clay Stamp / Custom Name Engraving / Kiln Baked Clay ,Craft Supplies & Tools,55.95,False,1,0,False,5,False,"Craft Supplies & Tools,Stamps & Seals,Stamps,cool gift for him,custom name seal,custom name carving,sealing stamp chop,chinese name seal,Asian gift for him,unique asian seal,porcelain seal,porcelain chop,clay sealing stamp,clay name stamp,clay name chop,kiln fired stamp",United States,,False,False,False,CalligraphyforGod,https://www.etsy.com/listing/731725035/unique-asian-name-seal-cool-gift-for-him,Upgrade Pro to Unlock
"Copper wood custom seal, Personal Name Stamp,Custom Chinese Chop Free Chinese Name Translation Seal ",Craft Supplies & Tools,33.99,False,1,0,False,10,False,"Craft Supplies & Tools,Stamps & Seals,Stamps,name seal,custom seal,personalized seal,personal seal,stone seal stamp,personal name stamp,dragon carving,Chinese culture,Calligraphy seal,painting,calligraphy brush,asian decor,brush set",United States,2020-12-07,False,False,False,SealCuttingArts,https://www.etsy.com/listing/919236983/copper-wood-custom-seal-personal-name,Upgrade Pro to Unlock
"Chinese Turtle Seal,Chinese Calligraphy Seal, Personal Name Stamp,Custom Chinese Chop Free Chinese Name Translation Seal. ",Craft Supplies & Tools,33.99,False,0,0,False,5,False,"Craft Supplies & Tools,Stamps & Seals,Stamps,name seal,custom seal,personalized seal,personal seal,stone seal stamp,personal name stamp,dragon carving,Chinese culture,Calligraphy seal,painting,calligraphy brush,asian decor,brush set",United States,,False,False,False,SealCuttingArts,https://www.etsy.com/listing/1211294298/chinese-turtle-sealchinese-calligraphy,Upgrade Pro to Unlock
"Chinese Traditional Calligraphy Brush,Chinese Painting Antithetical Couplet Writing Brush Board for Students and Beginners. ",Craft Supplies & Tools,29.99,False,1,0,False,9,False,"Craft Supplies & Tools,Stamps & Seals,Stamps,name seal,custom seal,personalized seal,personal seal,stone seal stamp,personal name stamp,dragon carving,Chinese culture,Calligraphy seal,painting,calligraphy brush,asian decor,brush set",,2022-03-04,False,False,False,SealCuttingArts,https://www.etsy.com/listing/1190295079/chinese-traditional-calligraphy,
"Custom Chinese Name Seal,Custom Japanese Name Chop Free Chinese Name Translation Stamp(various patten) ",Craft Supplies & Tools,30.99,False,0,0,False,7,False,"Craft Supplies & Tools,Stamps & Seals,Stamps,name seal,custom seal,personalized seal,personal seal,stone seal stamp,personal name stamp,dragon carving,Chinese culture,Calligraphy seal,painting,calligraphy brush,asian decor,brush set",,2021-11-28,False,False,False,SealCuttingArts,https://www.etsy.com/listing/1115937760/custom-chinese-name-sealcustom-japanese,
"Chinese Shoushan stone  seal, Personal Name Stamp,Custom Chinese Chop Free Chinese Name Translation Seal. ",Craft Supplies & Tools,22.99,False,0,0,False,2,False,"Craft Supplies & Tools,Stamps & Seals,Stamps,name seal,custom seal,personalized seal,personal seal,stone seal stamp,personal name stamp,dragon carving,Chinese culture,Calligraphy seal,painting,calligraphy brush,asian decor,brush set",,,False,False,False,SealCuttingArts,https://www.etsy.com/listing/966601011/chinese-shoushan-stone-seal-personal,
"Chinese She Yan inkstone,Inkstone Chinese calligraphy inkstone with cover for calligraphy practice and painting. ",Craft Supplies & Tools,28.99,False,2,0,False,15,False,"Craft Supplies & Tools,Stamps & Seals,Stamps,name seal,custom seal,personalized seal,personal seal,stone seal stamp,personal name stamp,dragon carving,Chinese culture,Calligraphy seal,painting,calligraphy brush,asian decor,brush set",,2022-02-15,False,False,False,SealCuttingArts,https://www.etsy.com/listing/1165750940/chinese-she-yan-inkstoneinkstone-chinese,
"Chinese 12 Zodiac Calligraphy Seal, Personal Name Stamp,Custom Chinese Chop Free Chinese Name Translation Seal. ",Craft Supplies & Tools,32.99,False,1,0,False,8,False,"Craft Supplies & Tools,Stamps & Seals,Stamps,name seal,custom seal,personalized seal,personal seal,stone seal stamp,personal name stamp,dragon carving,Chinese culture,Calligraphy seal,painting,calligraphy brush,asian decor,brush set",,,False,False,False,SealCuttingArts,https://www.etsy.com/listing/1367277991/chinese-12-zodiac-calligraphy-seal,
Beginner's supplies ink plate Porcelain Handmade Ink Well Inkstone with Brush Holder for Chinese Japanese Calligraphy Painting Practice. ,Craft Supplies & Tools,26.99,False,1,0,False,10,False,"Craft Supplies & Tools,Stamps & Seals,Stamps,name seal,custom seal,personalized seal,personal seal,stone seal stamp,personal name stamp,dragon carving,Chinese culture,Calligraphy seal,painting,calligraphy brush,asian decor,brush set",,2022-01-23,False,False,False,SealCuttingArts,https://www.etsy.com/listing/1151581580/beginners-supplies-ink-plate-porcelain,
Square Porcelain Name Chop / Chinese Signature Seal / Ceramic Glazed Pottery Seal With Hand Painted Chinese Flowers / Sweet Heart Gift ,Craft Supplies & Tools,45.95,False,3,0,False,15,False,"Craft Supplies & Tools,Stamps & Seals,Stamps,chinese name seal,chinese name chop,chinese name stamp,sweet heart gift,porcelain name seal,porcelain name stamp,hand painted seal,custom name stamp,custom name chop,name in chinese,custom chinese gift,custom asian gift,custom chinese chop",China,,False,False,False,CalligraphyforGod,https://www.etsy.com/listing/717865006/square-porcelain-name-chop-chinese,Upgrade Pro to Unlock
Asian Name Seal / Custom Chinese Chop With Ancient Script / White Square Stamp Personalized ,Craft Supplies & Tools,25.95,False,5,0,False,16,False,"Craft Supplies & Tools,Stamps & Seals,Stamps,Asian gift idea,China gift idea,asian student gift,asian teacher gift,Chinese stone seal,Chinese name stamp,Chinese name chop,Chinese name seal,engraved name seal,chinese agate seal,chinese seal chop,chinese seal stamp,chinese stone chop",China,,False,False,False,CalligraphyforGod,https://www.etsy.com/listing/791419515/asian-name-seal-custom-chinese-chop-with,Upgrade Pro to Unlock
Chinese colorful Seal Stamp for Painting Calligraphy Art seal name stamp free carving for you ,Craft Supplies & Tools,23.99,False,3,0,False,9,False,"Craft Supplies & Tools,Stamps & Seals,Stamps,name seal,custom seal,personalized seal,personal seal,stone seal stamp,personal name stamp,dragon carving,Chinese culture,Calligraphy seal,painting,calligraphy brush,asian decor,brush set",,2021-08-13,False,False,False,SealCuttingArts,https://www.etsy.com/listing/1052874108/chinese-colorful-seal-stamp-for-painting,
Chinese Style Handmade Engraving Zodiac Wood Stamp Custom Name Stamp With Cloth Bag For Children Girlfriend Parent Personal Seal ,Craft Supplies & Tools,33.99,False,2,0,False,13,False,"Craft Supplies & Tools,Stamps & Seals,Stamps,name seal,custom seal,personalized seal,personal seal,stone seal stamp,personal name stamp,dragon carving,Chinese culture,Calligraphy seal,painting,calligraphy brush,asian decor,brush set",,,False,False,False,SealCuttingArts,https://www.etsy.com/listing/1045498590/chinese-style-handmade-engraving-zodiac,
"Song Dynasty Duan Inkstone,Multifunctional Ink Tray/Ink Well for Beginning and  Chinese Japanese Calligraphy Practice. ",Craft Supplies & Tools,38.99,False,1,0,False,9,False,"Craft Supplies & Tools,Stamps & Seals,Stamps,name seal,custom seal,personalized seal,personal seal,stone seal stamp,personal name stamp,dragon carving,Chinese culture,Calligraphy seal,painting,calligraphy brush,asian decor,brush set",,,False,False,False,SealCuttingArts,https://www.etsy.com/listing/1260823203/song-dynasty-duan,
Hand fan. Purple bindweed and calligraphy in Chinese painting on paper. Painter 罗耐心 Luō Nàixīn Unique numbered work. greeting card ,Accessories > Hand Fans,36.38,False,0,0,False,3,False,"Fan,Manual Fan,Chinese Painting,Chinese Decoration,Calligraphy,Chinese Seals,Chinese Ink,Personalized Gift,Chinese Art,Asian Art,Bindweed,Birthday,Chinese First Name,Gifts for Girlfriend,Gifts for Mom,Birthday Gifts,Gifts for Her,Gifts",French,,False,False,False,CreaDina,https://www.etsy.com/listing/1510894749/hand-fan-purple-bindweed-and-calligraphy,Upgrade Pro to Unlock
"Chinese  pink Rabbit Seal, Personal Name Stamp,Custom Chinese Chop Free Chinese Name Translation Seal. ",Craft Supplies & Tools,47.99,False,0,0,False,0,False,"Craft Supplies & Tools,Stamps & Seals,Stamps,name seal,custom seal,personalized seal,personal seal,stone seal stamp,personal name stamp,dragon carving,Chinese culture,Calligraphy seal,painting,calligraphy brush,asian decor,brush set",,2023-01-31,False,False,False,SealCuttingArts,https://www.etsy.com/listing/1406801627/chinese-pink-rabbit-seal-personal-name,
"Personalized Name Seal wood Seal Cutting,Custom Asian Stamp,Custom Chinese name wood Seal with Your Name,  Name (Kanji )Hanko Chop ",Craft Supplies & Tools,19,False,0,0,False,5,False,"Craft Supplies & Tools,Stamps & Seals,Stamps,Stamp Bag,Custom Asian Stamp,wood Seal,Custom wood Seal,stamp name,Japanese Name Stamp,Chinese wood Seal,HandCrafted  Bag,custom",,,False,False,False,NineColorHAN,https://www.etsy.com/listing/1449717417/personalized-name-seal-wood-seal,
