Title,Category,"Price(""$"")",7-day sales,Total Sales,Total Reviews,7-day Reviews,Total Favorites,7-day Favorites,Tags,Ship From,Release Time,Best Seller,Etsy Pick,Raving,Store Name,Product URL,Image URL
Large 3 CM X 3 CM / Engraved Dragon Chinese Stamp / Asian Seal Chop / Personalize With Your Name ,Craft Supplies & Tools,31.95,0,6,0,0,7,0,"Chinese Seal,Chinese Chop,Chinese Stamp,Stone Engraving,Stone Seal,Seal Engraving,Carved Seal,Chinese Dragon,Name in Chinese,Chinese Chop Seal,Chinese Engraving,Dragon Chop,Chop Stamp Seal,Personalized Gifts,Gifts",United States,2021-09-02,False,False,False,CalligraphyforGod,https://www.etsy.com/listing/1077925357/large-3-cm-x-3-cm-engraved-dragon,Upgrade Pro to Unlock
"Chinese Shoushan  Chop Seal, Chinese custom Seal, Chinese Stone Seal Carving, Chinese Stone Circular  Seal With Your Name Hand Engraved. ",Craft Supplies & Tools,22.99,0,7,0,0,20,0,"Custom Chinese Chop,Custom Seal,Personal Seal,Name Seal,Stone Seal Stamp,Personal Name Stamp,Dragon Carving,Personalized Seal,Chinese Culture,Seal Cutting,Custom Chinese Seal,Character Chop,Personalized Chops,Gifts for Friends,Personalized Gifts,Gifts",United States,2020-06-13,False,False,False,SindyJoyiArts,https://www.etsy.com/listing/823774223/chinese-shoushan-chop-seal-chinese,Upgrade Pro to Unlock
White Dragon Stamp Customized English Name Stamp Custom Chinese Seal  Hand Carved Stone Chop White Square Seal ,Craft Supplies & Tools,28.99,0,0,0,0,28,0,"Square Seal,Stone Stamp,Chinese Chop,Name Seal,Chop Stamp,Chinese Seal,Personalized Seal,Chinese Stamp,Custom Chinese Chop,Private Seals,Chinese Seal Custom,Seal Chop Stamp,Engraved Stamps,Personalized Gifts",United States,2019-10-09,False,False,False,SemliCalligraphy,https://www.etsy.com/listing/729270144/white-dragon-stamp-customized-english,Upgrade Pro to Unlock
"Chinese Chop Seal, Chinese custom Seal, Chinese Stone Seal Carving, Chinese Stone Square Seal With Your Name Hand Engraved. ",Craft Supplies & Tools,31.99,0,1,0,0,12,0,"Custom Seal,Personal Seal,Dragon Carving,Personalized Seal,Seal Cutting,Chinese Culture,Custom Chinese Seal,Custom Chinese Chop,Personal Name Seal,Stone Seal Stamp,Personal Name Stamp,Character Chop,Personalized Chops,Gifts for Friends,Personalized Gifts,Gifts",United States,,False,False,False,SindyJoyiArts,https://www.etsy.com/listing/762470995/chinese-chop-seal-chinese-custom-seal,Upgrade Pro to Unlock
Custom Chinese Seal Design / Personalized Asian Stamp Chop / White Square With Decorative Tassel / Creative Chinese Gift Idea ,Art & Collectibles,31.95,0,8,0,0,18,0,"Chinese Chop Seal,Chinese Seal Stamp,Chinese Name Seal,Name in Chinese,Chinese Name Stamp,Personalized Chinese,Stamp Seal Carving,Custom Name Carving,Traditional Seal,Creative Chinese,Custom Seal Design,Custom Chop Design,Frozen Jade Seal,Personalized Gifts,Gifts",United States,2020-07-24,False,False,False,CalligraphyforGod,https://www.etsy.com/listing/829892304/custom-chinese-seal-design-personalized,Upgrade Pro to Unlock
"Chinese  Qingtian stone Seal, Chinese custom Seal, Chinese Stone Seal Carving, Chinese Stone Square Seal With Your Name Hand Engraved. ",Craft Supplies & Tools,40.99,0,13,0,0,31,0,"Custom Seal,Personal Seal,Name Seal,Dragon Carving,Personalized Seal,Chinese Culture,Seal Cutting,Custom Chinese Seal,Custom Chinese Chop,Stone Seal Stamp,Personal Name Stamp,Character Chop,Personalized Chops,Gifts for Friends,Personalized Gifts,Gifts",United States,2021-03-08,False,False,False,SindyJoyiArts,https://www.etsy.com/listing/962307088/chinese-qingtian-stone-seal-chinese,Upgrade Pro to Unlock
Lovely Rabbit Stone Seal - 3x3cm Bunny Stamp Chop w/. Gift Box ,Craft Supplies & Tools,39.99,0,6,0,0,38,0,"Stone Seal,Seal,Stamp,Chop,Chinese,Love,Bunny,Rabbit,Moon,12 Zodiac,Mid-autumn Festival,Rabbit Stone Seal,Gifts",China,,False,False,False,MyLittleHand,https://www.etsy.com/listing/529067235/lovely-rabbit-stone-seal-3x3cm-bunny,Upgrade Pro to Unlock
"Custom Seal, Stone Seal Carving, Chinese Stone Round Seal With Your Name/Logo Hand Engraved, Custom Made Seal Set. ",Craft Supplies & Tools,23.99,0,0,0,0,4,0,"Custom Seal,Dragon Carving,Seal Cutting,Chinese Culture,Personalized Seal,Custom Chinese Seal,Custom Chinese Chop,Personal Name Seal,Stone Seal Stamp,Personal Name Stamp,Character Chop,Personalized Chops,Calligraphy Seal,Gifts for Friends,Personalized Gifts,Gifts",United States,,False,False,False,SindyJoyiArts,https://www.etsy.com/listing/1223211047/custom-seal-stone-seal-carving-chinese,Upgrade Pro to Unlock
Vintage Chinese Seal Carving with Porcelain Ink Pad ,Craft Supplies & Tools,35,0,3,0,0,5,0,"Custom Stamp,Foo Dog,Rubber Stamp,Chinese Seal,Chop Stone,Personalized Gifts",United States,2020-09-06,False,False,False,HechoDeCorazon,https://www.etsy.com/listing/866339073/vintage-chinese-seal-carving-with,Upgrade Pro to Unlock
Gift for Chinese / Custom Engraved Name Stamp / Chinese Characters Seal / Chinese Traditional Gift for Him / Guardian Beast / Lion / Chop ,Craft Supplies & Tools,35.95,0,0,0,0,26,0,"Chinese Souvenir,Chinese Name Stamp,Chinese Culture,Gift for Chinese,Chinese Characters,Chinese Traditional,Custom Engraved Seal,Custom Engraved Chop,China Seal,China Chop Gift,China Stamping Seal,China Culture,Guardian Beast Seal,Gifts for Boyfriend,Gifts for Dad,Gifts for Husband,Gifts for Him,Personalized Gifts,Gifts",United States,,False,False,False,CalligraphyforGod,https://www.etsy.com/listing/657773157/gift-for-chinese-custom-engraved-name,Upgrade Pro to Unlock
"Custom Name Seal, Stone Seal Carving, Chinese Stone Square Seal With Your Name Hand Engraved, Custom Made Seal Set ",Craft Supplies & Tools,35.99,0,30,6,0,58,0,"Character Chop,Personal Name Stamp,Personal Seal,Custom Seal,Custom Chinese Seal,Seal Cutting,Chinese Culture,Personalized Seal,Personalized Chops,Stone Seal Stamp,Personal Name Seal,Custom Chinese Chop,Calligraphy Seal,Gifts for Friends,Personalized Gifts,Gifts",United States,2019-09-26,False,False,False,SindyJoyiArts,https://www.etsy.com/listing/725902254/custom-name-seal-stone-seal-carving,Upgrade Pro to Unlock
"China Imperial jade seal，Chinese Dragon Name Seal, Personal Personalized  Chinese Chop Free Chinese Name Translation Seal. ",Craft Supplies & Tools,74.99,0,14,5,0,53,0,"Name Seal,Custom Seal,Personalized Seal,Personal Seal,Personal Name Stamp,Dragon Carving,Chinese Culture,Painting,Calligraphy Brush,Asian Decor,Brush Set,Stone Seal Stamp,Calligraphy Seal,Personalized Gifts",United States,2021-10-31,False,False,False,SealCuttingArts,https://www.etsy.com/listing/1097865522/china-imperial-jade-sealchinese-dragon,Upgrade Pro to Unlock
Shoushan Stone Seal Pen Calligraphy Stamp Customized Name Stamp Square Private Seal for Teachers and Students ,Craft Supplies & Tools,19.99,0,35,9,0,64,0,"Square Seal,Stone Stamp,Chinese Chop,Name Seal,Chop Stamp,Chinese Seal,Personalized Seal,Chinese Stamp,Private Seals,Chinese Seal Custom,Seal Chop Stamp,Engraved Stamps,Custom Chinese Chop,Gifts for Friends,Gifts for Teachers,Personalized Gifts,Gifts",United States,2020-07-11,False,False,False,SemliCalligraphy,https://www.etsy.com/listing/794089474/shoushan-stone-seal-pen-calligraphy,Upgrade Pro to Unlock
Dark Brown Sandal Wood Asian Name Stamp / Personal Stamp Customized With Your Name / Chinese Gift Idea / Ink Pad And Wooden Carrying Case ,Art & Collectibles,35.99,0,6,0,0,16,0,"Asian Name Stamp,Chinese Name Chop,Chinese Name Stamp,Chinese Chop Stamp,Personal Name Seal,Wood Chop Seal,Custom Wood Seal,Chinese Wooden Chop,Chinese Wooden Seal,Chop Stamp Seal,Asian Name Chop,Chinese Wooden Stamp,Personalized Gifts,Gifts",United States,2021-02-04,False,False,False,CalligraphyforGod,https://www.etsy.com/listing/956254225/dark-brown-sandal-wood-asian-name-stamp,Upgrade Pro to Unlock
"Custom Name Seal, Stone Seal Carving, Chinese Stone Square Seal With Your Name Hand Engraved, Custom Made Seal Set ",Craft Supplies & Tools,24.99,0,9,0,0,33,0,"Custom Chinese Seal,Custom Seal,Personal Seal,Name Seal,Personal Name Stamp,Character Chop,Dragon Carving,Personalized Seal,Chinese Culture,Seal Cutting,Custom Chinese Chop,Stone Seal Stamp,Personalized Chops,Gifts for Friends,Personalized Gifts,Gifts",United States,,False,False,False,SindyJoyiArts,https://www.etsy.com/listing/745846349/custom-name-seal-stone-seal-carving,Upgrade Pro to Unlock
"Chinese Dandong green stone Seal, Personal Name Stamp,Custom Chinese Chop Free Chinese Name Translation Seal. ",Craft Supplies & Tools,29.99,0,0,0,0,3,0,"Name Seal,Custom Seal,Personalized Seal,Personal Seal,Stone Seal Stamp,Personal Name Stamp,Dragon Carving,Chinese Culture,Painting,Calligraphy Brush,Asian Decor,Brush Set,Calligraphy Seal,Personalized Gifts",United States,2022-04-16,False,False,False,SealCuttingArts,https://www.etsy.com/listing/1202412334/chinese-dandong-green-stone-seal,Upgrade Pro to Unlock
"Name Stamps, Name Private Stamps, Calligraphy Stamps, Square Stamps, Resin Stamps, Chinese Art Stamps, Gifts, Gifts for Family Members ",Craft Supplies & Tools,29.93,0,0,0,0,0,0,"Name Stamp,Seals,Chinese Name Stamp,Signet,Chinese Seal,Square,Brass Stamp,Birthday Gifts,Gifts,Chinese Art Seal,Private Chop,Private Seal,Mother's Day Gifts,Birthday Gifts,Gifts for Couples,Gifts for Friends,Gifts",China,,False,False,False,CopingGifts,https://www.etsy.com/listing/1436228358/name-stamps-name-private-stamps,Upgrade Pro to Unlock
"Chinese Dragon Name Seal, Personal Name Stamp,Custom Chinese Chop Free Chinese Name Translation Seal. ",Craft Supplies & Tools,84,0,2,0,0,10,0,"Name Seal,Custom Seal,Personalized Seal,Personal Seal,Stone Seal Stamp,Personal Name Stamp,Dragon Carving,Chinese Culture,Painting,Calligraphy Brush,Asian Decor,Brush Set,Calligraphy Seal,Personalized Gifts",United States,2021-09-09,False,False,False,SealCuttingArts,https://www.etsy.com/listing/1081852377/chinese-dragon-name-seal-personal-name,Upgrade Pro to Unlock
"Two Koi Chop Stamp — red Japanese seal in Old Style known as Inkan or Hanko, feng shui art ",Craft Supplies & Tools,95,0,3,0,0,30,0,"Japanese Hanko,Chinese Chop Stamp,Feng Shui Art,Feng Shui Gift,Two Koi Chop,Koi Chop Stamp,Red Japanese Seal,Seal in Old Style,Inkan Chop,Buddhist Stone Seal,Red Oriental Stamp,Stone Carved Seal,Stone Carved Stamp,Personalized Gifts,Gifts",Hungary,,False,False,False,AnnaVladiArt,https://www.etsy.com/listing/854131253/two-koi-chop-stamp-red-japanese-seal-in,Upgrade Pro to Unlock
Name Stone Seal - Chinese Fonts  ,Art & Collectibles,26.88,0,34,6,0,59,0,"Stone Seal,Seal,Stamp,Chop,Chinese,Free Shipping,Name,Name Chop,Edith",China,2019-02-28,False,False,False,MyLittleHand,https://www.etsy.com/listing/672989276/name-stone-seal-chinese-fonts-shawnette,Upgrade Pro to Unlock
Year of the Ox Chinese Zodiac Seal / Chinese Ox Name Chop / 3 X 3 CM / Chinese Chop Seal / Ox Year Birthday Gift Idea ,Craft Supplies & Tools,39.95,0,13,0,0,22,0,"Chinese Name Seal,Chinese Zodiac Seal,Chinese Calendar,Hand Carved Stamp,Seal Chop Stamp,Chinese Ox Year,Year of the Bull,Ox Year Name Stamp,Ox Year Gift Idea,Ox Year Birthday,Asian Zodiac Ox,Year of the Ox Stamp,Year of the Ox Chop,Birthday Gifts,Personalized Gifts,Gifts",United States,2021-07-11,False,False,False,CalligraphyforGod,https://www.etsy.com/listing/915430207/year-of-the-ox-chinese-zodiac-seal,Upgrade Pro to Unlock
"Chinese jade Stone Seal, Personal Name Stamp,Custom Chinese Chop Free Chinese Name Translation Seal. ",Craft Supplies & Tools,36.99,0,1,0,0,3,0,"Name Seal,Personal Seal,Dragon Carving,Chinese Culture,Painting,Calligraphy Brush,Asian Decor,Brush Set,Custom Seal,Personalized Seal,Stone Seal Stamp,Personal Name Stamp,Calligraphy Seal,Personalized Gifts",United States,2021-06-19,False,False,False,SealCuttingArts,https://www.etsy.com/listing/1038591521/chinese-jade-stone-seal-personal-name,Upgrade Pro to Unlock
"Custom  Name Seal, Stone Seal Carving, Chinese Stone Square Seal With Your Name Hand Engraved, Custom Made Seal Set ",Craft Supplies & Tools,35.99,0,1,0,0,4,0,"Custom Chinese Seal,Custom Seal,Dragon Carving,Seal Cutting,Chinese Culture,Personalized Seal,Custom Chinese Chop,Personal Name Seal,Stone Seal Stamp,Personal Name Stamp,Character Chop,Personalized Chops,Calligraphy Seal,Gifts for Friends,Personalized Gifts,Gifts",United States,2022-01-26,False,False,False,SindyJoyiArts,https://www.etsy.com/listing/1153214612/custom-name-seal-stone-seal-carving,Upgrade Pro to Unlock
"Chinese Calligraphy Seal, Personal Name Stamp,Custom Chinese Chop Free Chinese Name Translation Seal. ",Craft Supplies & Tools,23.99,0,2,0,0,18,0,"Name Seal,Custom Seal,Personalized Seal,Personal Seal,Dragon Carving,Chinese Culture,Painting,Calligraphy Brush,Asian Decor,Brush Set,Stone Seal Stamp,Personal Name Stamp,Calligraphy Seal,Personalized Gifts",United States,2022-03-22,False,False,False,SealCuttingArts,https://www.etsy.com/listing/1201201559/chinese-calligraphy-seal-personal-name,Upgrade Pro to Unlock
Chinese Name Stone Seal [Japan KOI Fish] - 2 x 4cm Chinese Stamp Chop ,Art & Collectibles,44,0,0,0,0,18,0,"Stone Seal,Seal,Stamp,Chop,Chinese,Name,Fish,Koi,Japan,KOI Fish,Japan Fish,Name Chop",China,,False,False,False,MyLittleHand,https://www.etsy.com/listing/1465675997/chinese-name-stone-seal-japan-koi-fish-2,Upgrade Pro to Unlock
"Custom  Name Seal, Stone Seal Carving, Chinese Stone Circle Seal With Your Name Hand Engraved, Custom Made Seal Set ",Craft Supplies & Tools,22.99,0,35,11,0,30,0,"Custom Chinese Seal,Custom Seal,Dragon Carving,Seal Cutting,Chinese Culture,Personalized Seal,Custom Chinese Chop,Personal Name Seal,Stone Seal Stamp,Personal Name Stamp,Character Chop,Personalized Chops,Calligraphy Seal,Gifts for Friends,Personalized Gifts,Gifts",United States,2022-01-28,False,False,False,SindyJoyiArts,https://www.etsy.com/listing/1154770432/custom-name-seal-stone-seal-carving,Upgrade Pro to Unlock
"Chinese Name Seal, Chinese custom Seal Carving, Chinese Seal With Your Name set Wood Gift box for Painting Calligraphy ",Craft Supplies & Tools,24.99,0,0,0,0,46,0,"Custom Chinese Seal,Custom Seal,Personal Seal,Name Seal,Dragon Carving,Personalized Seal,Seal Cutting,Chinese Culture,Custom Chinese Chop,Stone Seal Stamp,Personal Name Stamp,Character Chop,Personalized Chops,Gifts for Friends,Personalized Gifts,Gifts",United States,2019-10-15,False,False,False,SindyJoyiArts,https://www.etsy.com/listing/730716156/chinese-name-seal-chinese-custom-seal,Upgrade Pro to Unlock
Oval Jade Chinese Seal Custom Birthday Gift Stone Stamp Chisel Carve Signature Name Chop for Calligraphy Painting Book Collection E343 ,Craft Supplies & Tools,30,0,0,0,0,3,0,"Birthday,Enrollment,Graduation,Wedding,Engagement,Square,Round,Rectangle,Book,Collection,Cloth,Canvas,Name Card,Birthday Gifts,Gifts for Friends,Gifts for Teachers,Personalized Gifts,Gifts",United States,,False,False,False,salientstone,https://www.etsy.com/listing/677946794/oval-jade-chinese-seal-custom-birthday,Upgrade Pro to Unlock
1 Piece of Maitreya Buddha MiLeFo Chinese Seal Stone Stamp Chisel Carving Name Chop Customized for calligraphy painting kanji hanko E442 ,Craft Supplies & Tools,30,0,0,0,0,7,0,"Birthday,Enrollment,Graduation,Wedding,Engagement,Square,Round,Rectangle,Book,Collection,Cloth,Canvas,Name Card,Birthday Gifts,Gifts for Friends,Gifts for Teachers,Personalized Gifts",United States,,False,False,False,salientstone,https://www.etsy.com/listing/695454569/1-piece-of-maitreya-buddha-milefo,Upgrade Pro to Unlock
"Chinese Name Seal, Chinese custom Seal Carving, Chinese Seal With Your Name set Wood Gift box for Painting Calligraphy. ",Craft Supplies & Tools,30.99,0,0,0,0,9,0,"Custom Seal,Dragon Carving,Seal Cutting,Chinese Culture,Personalized Seal,Custom Chinese Seal,Custom Chinese Chop,Personal Name Seal,Stone Seal Stamp,Personal Name Stamp,Character Chop,Personalized Chops,Calligraphy Seal,Gifts for Friends,Personalized Gifts,Gifts",United States,,False,False,False,SindyJoyiArts,https://www.etsy.com/listing/1553494092/chinese-name-seal-chinese-custom-seal,Upgrade Pro to Unlock
2 x 2.5 cm  ,Craft Supplies & Tools,49.99,0,2,0,0,16,0,"Stone Seal,Seal,Stamp,Chop,Chinese,Free Shipping,Gifts,Red Paste,Ink Pad,Ballet,Dancing,Stone Chop,Dancing Chop,Gifts",China,,False,False,False,MyLittleHand,https://www.etsy.com/listing/505243878/2-x-25-cm-dancing-ballet-stamp-chop-with,Upgrade Pro to Unlock
"Custom Chinese White agate Seal,Custom Japanese Name Chop Free Chinese Name Translation Stamp. ",Craft Supplies & Tools,35.99,0,1,0,0,6,0,"Name Seal,Custom Seal,Personalized Seal,Personal Seal,Stone Seal Stamp,Personal Name Stamp,Dragon Carving,Chinese Culture,Painting,Calligraphy Brush,Asian Decor,Brush Set,Calligraphy Seal,Personalized Gifts,Gifts",United States,2022-01-03,False,False,False,SealCuttingArts,https://www.etsy.com/listing/1153027321/custom-chinese-white-agate-sealcustom,Upgrade Pro to Unlock
"Chinese Shoushan stone Seal, Personal Name Stamp,Custom Chinese Chop Free Chinese Name Translation Seal. ",Craft Supplies & Tools,49.99,0,4,0,0,12,0,"Custom Chinese Chop,Custom Seal,Stone Seal Stamp,Personal Name Stamp,Dragon Carving,Calligraphy Seal,Chinese Culture,Personalized Seal,Custom Chinese Seal,Personal Name Seal,Character Chop,Personalized Chops,Seal Cutting,Gifts for Friends,Personalized Gifts,Gifts",United States,2021-09-05,False,False,False,SindyJoyiArts,https://www.etsy.com/listing/1065621468/chinese-shoushan-stone-seal-personal,Upgrade Pro to Unlock
"Custom  Name Seal, Stone Seal Carving, Chinese Stone Square Seal With Your Name Hand Engraved, Custom Made Seal Set ",Craft Supplies & Tools,27.99,0,0,0,0,0,0,"Custom Chinese Chop,Custom Seal,Stone Seal Stamp,Personal Name Stamp,Dragon Carving,Chinese Culture,Calligraphy Seal,Personalized Seal,Custom Chinese Seal,Personal Name Seal,Character Chop,Personalized Chops,Seal Cutting,Gifts for Friends,Personalized Gifts,Gifts",United States,,False,False,False,SindyJoyiArts,https://www.etsy.com/listing/1227374951/custom-name-seal-stone-seal-carving,Upgrade Pro to Unlock
"Chinese Calligraphy Stone Seal, Personal Name Stamp,Custom Chinese Chop Free Chinese Name Translation Seal（2CM） ",Craft Supplies & Tools,24.99,0,0,0,0,2,0,"Name Seal,Custom Seal,Personalized Seal,Personal Seal,Personal Name Stamp,Dragon Carving,Chinese Culture,Calligraphy Seal,Painting,Calligraphy Brush,Asian Decor,Brush Set,Stone Seal Stamp,Personalized Gifts,Gifts",United States,,False,False,False,SealCuttingArts,https://www.etsy.com/listing/833114734/chinese-calligraphy-stone-seal-personal,Upgrade Pro to Unlock
"Custom Chinese Purple robe jade Seal,Custom Japanese Name Chop Free Chinese Name Translation Stamp. ",Craft Supplies & Tools,26.99,0,0,0,0,6,0,"Name Seal,Custom Seal,Personalized Seal,Personal Seal,Personal Name Stamp,Dragon Carving,Chinese Culture,Calligraphy Seal,Painting,Calligraphy Brush,Asian Decor,Brush Set,Stone Seal Stamp,Personalized Gifts",United States,2021-12-26,False,False,False,SealCuttingArts,https://www.etsy.com/listing/1148107725/custom-chinese-purple-robe-jade,Upgrade Pro to Unlock
"Rosewood and OX horns Stamp,Chinese Name Seal, custom Seal, Chinese Seal Carving, Chinese Circular Seal With Your Name Hand Engraved. ",Craft Supplies & Tools,29.99,0,7,0,0,22,0,"Custom Chinese Seal,Custom Seal,Personal Seal,Name Seal,Personal Name Stamp,Character Chop,Dragon Carving,Personalized Seal,Chinese Culture,Seal Cutting,Custom Chinese Chop,Stone Seal Stamp,Personalized Chops,Gifts for Friends,Personalized Gifts,Gifts",United States,2020-08-11,False,False,False,SindyJoyiArts,https://www.etsy.com/listing/852610033/rosewood-and-ox-horns-stampchinese-name,Upgrade Pro to Unlock
"Black Agage Seal,Custom  Name Seal, Stone Seal Carving, Chinese Stone Round Seal With Your Name Hand Engraved, Custom Made Seal Set ",Craft Supplies & Tools,53.99,0,0,0,0,8,0,"Custom Chinese Seal,Custom Seal,Personal Name Stamp,Character Chop,Dragon Carving,Seal Cutting,Chinese Culture,Personalized Seal,Custom Chinese Chop,Personal Name Seal,Stone Seal Stamp,Personalized Chops,Calligraphy Seal,Gifts for Friends,Personalized Gifts,Gifts",United States,2022-03-11,False,False,False,SindyJoyiArts,https://www.etsy.com/listing/1180416998/black-agage-sealcustom-name-seal-stone,Upgrade Pro to Unlock
"Custom  Green  agate Seal, Stone Seal Carving, Chinese Stone Square Seal With Your Name Hand Engraved, Custom Made Seal Set ",Craft Supplies & Tools,24.99,0,2,0,0,12,0,"Custom Chinese Seal,Custom Seal,Personal Name Stamp,Character Chop,Dragon Carving,Seal Cutting,Chinese Culture,Personalized Seal,Custom Chinese Chop,Personal Name Seal,Stone Seal Stamp,Personalized Chops,Calligraphy Seal,Gifts for Friends,Personalized Gifts,Gifts",United States,2022-03-01,False,False,False,SindyJoyiArts,https://www.etsy.com/listing/1174112980/custom-green-agate-seal-stone-seal,Upgrade Pro to Unlock
Marilyn Monroe Stone Seal - Sexiest Women Stamp Chop w/. Gift Box ,Craft Supplies & Tools,38,0,2,0,0,10,0,"Stone Seal,Seal,Stamp,Chop,Chinese,Free Shipping,Marilyn Monroe,Sexiest Women,Gifts",China,,False,False,False,MyLittleHand,https://www.etsy.com/listing/227251764/marilyn-monroe-stone-seal-sexiest-women,Upgrade Pro to Unlock
"Chinese Qingtian  Stone Seal, Chinese custom Seal, Chinese Stone Seal Carving, Chinese Stone Square Seal With Your Name Hand Engraved. ",Craft Supplies & Tools,36.99,0,11,0,0,27,0,"Custom Chinese Seal,Custom Seal,Personal Seal,Personal Name Stamp,Character Chop,Dragon Carving,Personalized Seal,Seal Cutting,Chinese Culture,Custom Chinese Chop,Personal Name Seal,Stone Seal Stamp,Personalized Chops,Gifts for Friends,Personalized Gifts,Gifts",United States,2020-07-06,False,False,False,SindyJoyiArts,https://www.etsy.com/listing/820504386/chinese-qingtian-stone-seal-chinese,Upgrade Pro to Unlock
"Custom Brass Seal, Seal Carving, Chinese Seal With Your Name  set  Wood Gift box for Painting Calligraphy ",Craft Supplies & Tools,25.99,0,1,0,0,15,0,"Custom Seal,Personal Name Seal,Stone Seal Stamp,Personal Name Stamp,Dragon Carving,Chinese Culture,Personalized Seal,Custom Chinese Seal,Custom Chinese Chop,Character Chop,Personalized Chops,Seal Cutting,Calligraphy Seal,Gifts for Friends,Personalized Gifts,Gifts",United States,2021-09-26,False,False,False,SindyJoyiArts,https://www.etsy.com/listing/1077500438/custom-brass-seal-seal-carving-chinese,Upgrade Pro to Unlock
Chinese Stone Seal Set - The Moon Story (Chang'e & Rabbit Bunny) Stamp Chop w/. Gift Box ,Craft Supplies & Tools,49.99,0,7,0,0,43,0,"Stone Seal,Seal,Stamp,Chop,Chinese,Free Shipping,Goddess of the Moon,Chinese God,Moon,Mid-autumn Festival,Chinese Festival,Easter,Mid-autumn,Gifts",China,2017-04-03,False,False,False,MyLittleHand,https://www.etsy.com/listing/522536243/chinese-stone-seal-set-the-moon-story,Upgrade Pro to Unlock
Custom Chinese Name Seal Handmade Chinese Chop for Chinese Calligraphy and Painting Custom Personal Stamp ,Craft Supplies & Tools,29.99,0,4,0,0,12,0,"Stone Stamp,Chinese Chop,Name Seal,Chop Stamp,Chinese Seal,Personalized Seal,Chinese Stamp,Private Seals,Square Seal,Chinese Seal Custom,Seal Chop Stamp,Engraved Stamps,Custom Chinese Chop,Personalized Gifts",United States,2020-09-03,False,False,False,SemliCalligraphy,https://www.etsy.com/listing/864942201/custom-chinese-name-seal-handmade,Upgrade Pro to Unlock
"Chinese future is bright stamp Brass Seal,Custom Name Seal,Chinese Copper Seal With Your Name Engraved,Custom Made Seal Set ",Craft Supplies & Tools,39.99,0,0,0,0,0,0,"Custom Chinese Seal,Custom Seal,Stone Seal Stamp,Personal Name Stamp,Character Chop,Dragon Carving,Seal Cutting,Chinese Culture,Calligraphy Seal,Personalized Seal,Custom Chinese Chop,Personal Name Seal,Personalized Chops,Gifts for Friends,Personalized Gifts,Gifts",United States,,False,False,False,SindyJoyiArts,https://www.etsy.com/listing/1500321504/chinese-future-is-bright-stamp-brass,Upgrade Pro to Unlock
"Custom Sandalwood Name Seal, Wood Seal Carving, Chinese Style Round Seal With Your Name Hand Engraved, Custom Made Seal Set. ",Craft Supplies & Tools,19.99,0,0,0,0,9,0,"Custom Chinese Chop,Custom Seal,Stone Seal Stamp,Personal Name Stamp,Dragon Carving,Seal Cutting,Chinese Culture,Calligraphy Seal,Personalized Seal,Custom Chinese Seal,Personal Name Seal,Character Chop,Personalized Chops,Gifts for Friends,Personalized Gifts,Gifts",United States,,False,False,False,SindyJoyiArts,https://www.etsy.com/listing/1328438033/custom-sandalwood-name-seal-wood-seal,Upgrade Pro to Unlock
"Chinese Buddha statue Seal, Personal Name Stamp,Custom Chinese Chop Free Chinese Name Translation Seal. ",Craft Supplies & Tools,25.99,0,5,0,0,5,0,"Name Seal,Custom Seal,Personalized Seal,Personal Seal,Stone Seal Stamp,Personal Name Stamp,Dragon Carving,Chinese Culture,Calligraphy Seal,Painting,Calligraphy Brush,Asian Decor,Brush Set,Personalized Gifts",United States,2021-07-31,False,False,False,SealCuttingArts,https://www.etsy.com/listing/1046238198/chinese-buddha-statue-seal-personal-name,Upgrade Pro to Unlock
"Chinese Shou shan stone name seal,  Chinese custom Seal Carving, Chinese Seal With Your Name  set  Wood Gift box for Painting Calligraphy ",Craft Supplies & Tools,32.99,0,0,0,0,0,0,"Custom Chinese Chop,Custom Seal,Stone Seal Stamp,Personal Name Stamp,Dragon Carving,Seal Cutting,Calligraphy Seal,Chinese Culture,Personalized Seal,Custom Chinese Seal,Personal Name Seal,Character Chop,Personalized Chops,Gifts for Friends,Personalized Gifts,Gifts",United States,,False,False,False,SindyJoyiArts,https://www.etsy.com/listing/1110225185/chinese-shou-shan-stone-name-seal,Upgrade Pro to Unlock
