Title,Category,"Price(""$"")",7-day sales,Total Sales,Total Reviews,7-day Reviews,Total Favorites,7-day Favorites,Tags,Ship From,Release Time,Best Seller,Etsy Pick,Raving,Store Name,Product URL,Image URL
Square Japanese Hanko Chop Japanese Name Stamp Chinese Name Stamp Custom Wood Stamp Japanese Stationery Chinese Name Seal ,Craft Supplies & Tools,23.99,20,1350,202,3,3492,14,"Square,New Year Gift,Birthday Gift,Graduation Gift,Japanese Stamp,Hanko Chop,Name Stamp,Japanese Stationery,Chinese Stamp,Christmas Gift,Japanese Hanko,Japanese Signature,Japanese Chop,Birthday Gifts,Christmas Gifts,Personalized Gifts,Gifts",United States,2020-07-13,False,False,False,SemliCalligraphy,https://www.etsy.com/listing/838077651/square-japanese-hanko-chop-japanese-name,Upgrade Pro to Unlock
Chinese calligraphy seal /Japanese sumi painting Stamp/Rectangular Corner Stamp/Stone Seal Engraving/Custom Mood Seal ,Craft Supplies & Tools,25.99,6,50,15,0,190,2,"Square Seal,Stone Stamp,Chinese Chop,Name Seal,Chop Stamp,Chinese Seal,Personalized Seal,Chinese Stamp,Private Seals,Chinese Seal Custom,Seal Chop Stamp,Engraved Stamps,Custom Chinese Chop,Personalized Gifts",United States,2022-11-02,False,False,False,SemliCalligraphy,https://www.etsy.com/listing/1323898346/chinese-calligraphy-seal-japanese-sumi,Upgrade Pro to Unlock
"Chinese zodiac Chop Seal, Chinese custom Seal, Chinese Stone Seal Carving, Chinese Stone Square Seal With Your Name Hand Engraved. ",Craft Supplies & Tools,37.99,5,96,25,0,269,2,"Custom Chinese Seal,Custom Seal,Personal Seal,Stone Seal Stamp,Personal Name Stamp,Character Chop,Dragon Carving,Personalized Seal,Seal Cutting,Chinese Culture,Custom Chinese Chop,Personal Name Seal,Personalized Chops,Gifts for Friends,Personalized Gifts,Gifts",United States,2020-05-14,False,False,False,SindyJoyiArts,https://www.etsy.com/listing/809091495/chinese-zodiac-chop-seal-chinese-custom,Upgrade Pro to Unlock
"Customized Round Sandalwood Stamp, Japanese Hanko Chop, Wood Name Seal, Chinese/Korean Name Stamp, English Name Stamp ",Craft Supplies & Tools,20,4,162,64,1,693,8,"Name Stamp,Personalized Stamp,Wood Name Sign,Name Seal,Seal Stamp,Japanese Name Seal,Japanese Name Stamp,Chinese Name,Korean Name Stamp,Japanese Name,Japanese Kanji,Custom Name Stamp,Name Chop,Personalized Gifts",United States,2022-10-11,False,False,False,DancingLionsBar,https://www.etsy.com/listing/1308402150/customized-round-sandalwood-stamp,Upgrade Pro to Unlock
DIY Stone Seal Engraving Set 27 Blank  Carving Chops Carve Personal Name Chops Custom Seal Name Stamp Engraving Kit Carve ,Craft Supplies & Tools,49.99,4,50,11,0,199,0,"Square,Chinese Seal Clamp,Stone Seal,Chinese Name Seal,Chinese Chop,Chinese Stamp,Square Seal,Square Stamp,Chinese Seal,Stone Seal Blank,Stamp Chop,Japanese Chop Blank,Hanko Chop Blank,Personalized Gifts",United States,2019-12-04,False,False,False,SemliCalligraphy,https://www.etsy.com/listing/745219626/diy-stone-seal-engraving-set-27-blank,Upgrade Pro to Unlock
Custom Name Seal/Green Stone Seal Carving/Chinese Stone Square Seal With Your Name Hand Engraved/Custom Made Seal Set ,Craft Supplies & Tools,45.99,3,22,4,0,47,0,"Square Seal,Stone Stamp,Chinese Chop,Name Seal,Chop Stamp,Chinese Seal,Personalized Seal,Chinese Stamp,Private Seals,Chinese Seal Custom,Seal Chop Stamp,Engraved Stamps,Custom Chinese Chop,Personalized Gifts",United States,2022-08-11,False,False,False,SemliCalligraphy,https://www.etsy.com/listing/1284217393/custom-name-sealgreen-stone-seal,Upgrade Pro to Unlock
"5PCS Chinese Shoushan stone , For Chinese Stone Seal Carving,chinese seal carving practice. ",Craft Supplies & Tools,29.99,2,30,6,0,43,0,"Custom Chinese Seal,Custom Seal,Personal Seal,Name Seal,Stone Seal Stamp,Personal Name Stamp,Character Chop,Dragon Carving,Personalized Seal,Chinese Culture,Seal Cutting,Custom Chinese Chop,Personalized Chops,Gifts for Friends,Personalized Gifts,Gifts",United States,2020-06-16,False,False,False,SindyJoyiArts,https://www.etsy.com/listing/825285621/5pcs-chinese-shoushan-stone-for-chinese,Upgrade Pro to Unlock
Japanese Hanko Chop Chinese Name Stamp Custom Wood Stamp Japanese Stationery Chinese Name Seal ,Craft Supplies & Tools,23.99,1,182,44,0,555,0,"Christmas Gift,Graduation Gift,Birthday Gift,Hanko,Chinese Seal,Stamp,Japanese Stationery,New Year Gift,Hanko Chop,Japanese Seal,Japanese Stamp,Japanese Signature,Sumi Painting,Birthday Gifts,Christmas Gifts,Gifts for Friends,Personalized Gifts,Gifts",United States,2020-09-08,False,False,False,SemliCalligraphy,https://www.etsy.com/listing/821786102/japanese-hanko-chop-chinese-name-stamp,Upgrade Pro to Unlock
"Custom Stamp/Custom Chinese Name Seal / Stone Seal Carving /Chinese Artist Chop/Eco-Friendly Stamp/Stone Stamp/Personal Seal/,1cm*2.6cm*6cm ",Craft Supplies & Tools,52.39,1,17,6,0,43,0,"Stone Stamp,Personalized Stamp,Custom Stamp,Self Inking Stamp,Chinese Stamp,Envelope Seal,Gift for Teacher,Business Stamp,Branding Stamp,Stamper,Logo Stamp,Wax Seal With,Gifts for Teachers,Personalized Gifts,Gifts",British,2022-09-29,False,False,False,TreVincentShop,https://www.etsy.com/listing/1300984548/custom-stampcustom-chinese-name-seal,Upgrade Pro to Unlock
"Customized Square Sandalwood Stamp, Japanese Hanko Chop, Wood Name Seal, Chinese/Korean Name Stamp, English Name Stamp ",Craft Supplies & Tools,25,1,260,72,1,494,4,"Name Stamp,Custom Name Stamp,Personalized Stamp,Wood Name Sign,Name Seal,Seal Stamp,Japanese Name Seal,Japanese Name Stamp,Chinese Name,Korean Name Stamp,Name Chop,Personalized Gifts",United States,2022-07-27,False,False,False,DancingLionsBar,https://www.etsy.com/listing/1275293621/customized-square-sandalwood-stamp,Upgrade Pro to Unlock
Custom Rectangle Japanese Hanko Chop - Japanese Name Stamp - Chinese Name Stamp - Chinese Name Seal - Personalized Wood Japanese Stationery ,Craft Supplies & Tools,45.99,1,30,7,0,77,1,"Japanese Stationery,Name Stamp,Japanese Hanko,Personalized Gift,Japanese Name Stamp,Wooden Stamp,Stamp With Ink,Red Circle Stamp,In Japanese,Hanko Inkan Stamp,Japanese Geek,Studying Japanese,Personalized Gifts,Gifts",United States,2022-01-09,False,False,False,ExoticMerchantCrafts,https://www.etsy.com/listing/1156888525/custom-rectangle-japanese-hanko-chop,Upgrade Pro to Unlock
Custom Chinese Name Private Seal Traditional Seal Natural Withe Stone Name Stamp Calligraphy Stamp Ancient Art of Chop Signet ,Craft Supplies & Tools,18.89,1,78,14,0,288,0,"Square Seal,Stone Stamp,Chinese Chop,Name Seal,Chop Stamp,Chinese Seal,Personalized Seal,Chinese Stamp,Private Seals,Chinese Seal Custom,Seal Chop Stamp,Engraved Stamps,Custom Chinese Chop,Gifts for Friends,Personalized Gifts,Gifts",United States,2020-04-22,False,False,False,SemliCalligraphy,https://www.etsy.com/listing/739207972/custom-chinese-name-private-seal,Upgrade Pro to Unlock
DIY Stone Seal Engraving Set 16 Blank  Carving Chops Carve Personal Name Chops Custom Seal Name Stamp Engraving Kit Carve ,Craft Supplies & Tools,39.99,1,22,4,0,132,0,"Square,Stone Seal,Chinese Name Seal,Chinese Chop,Chinese Stamp,Stamp Chop,Square Seal,Square Stamp,Chinese Seal,Chinese Seal Clamp,Stone Seal Blank,Japanese Chop Blank,Hanko Chop Blank,Personalized Gifts",United States,2019-07-10,False,False,False,SemliCalligraphy,https://www.etsy.com/listing/706407054/diy-stone-seal-engraving-set-16-blank,Upgrade Pro to Unlock
Blue Seal Ink Paste / Chinese Chop Ink Set Blue / Cinnabar Paste Blue / Ink Paste Porcelain Bowl Or Gift Box Set / Blue Ink Pad For Seals ,Craft Supplies & Tools,12.95,1,31,6,0,42,0,"Chinese Chop Ink,Green Paste for Seal,Blue Ink Paste,Blue Asian Ink Pot,Blue Seal Paste,Blue Ink Mud,Blue Paste Ink Set,Blue Cinnabar Ink,Blue Ink Paste Dish,Blue Ink Paste Bowl,Seal Ink Blue,Chop Ink Blue,Blue Stamping Ink,Gifts",United States,2019-11-01,False,False,False,CalligraphyforGod,https://www.etsy.com/listing/641241287/blue-seal-ink-paste-chinese-chop-ink-set,Upgrade Pro to Unlock
Chinese Chop Seal Carved Soapstone Handmade Unique Signature Seal Statement Chinese Chop ,Art & Collectibles > Sculpture > Art Objects,175,0,90,0,0,1020,0,"Art & Collectibles,Sculpture,Art Objects,Chinese Chop,Signature Seal,Carved Soapstone,World of Bacara,Home Decor,Gift Idea,Birthday Present,Christmas Gift,Asian Art,Asian Decor,House Warming Gift,Chinese Art,Chinese Seal",United States,2015-09-06,False,False,False,WorldofBacara,https://www.etsy.com/listing/246842581/chinese-chop-seal-carved-soapstone,Upgrade Pro to Unlock
White Dragon Stamp Customized English Name Stamp Custom Chinese Seal  Hand Carved Stone Chop White Square Seal ,Craft Supplies & Tools,28.99,0,13,0,0,29,0,"Craft Supplies & Tools,Stamps & Seals,Seals,Private Seals,Square seal,Stone stamp,chinese seal custom,seal chop stamp,chinese chop,name seal,chop stamp,chinese seal,personalized seal,chinese stamp,engraved stamps,custom chinese chop",United States,2019-10-09,False,False,False,SemliCalligraphy,https://www.etsy.com/listing/729270144/white-dragon-stamp-customized-english,Upgrade Pro to Unlock
"Chinese Qingtian Stone Chop Seal, Chinese custom Seal, Chinese Stone Seal Carving, Chinese Stone Square Seal With Your Name Hand Engraved. ",Craft Supplies & Tools,34.99,0,2,0,0,2,0,"Craft Supplies & Tools,Stamps & Seals,Stamps,custom chinese seal,custom chinese chop,custom seal,personal name seal,personal  seal,stone seal stamp,personal name stamp,character chop,personalized chops,dragon carving,personalized seal,seal cutting,Chinese culture",,2021-06-21,False,False,False,SindyJoyiArts,https://www.etsy.com/listing/1025406850/chinese-qingtian-stone-chop-seal-chinese,
"Chinese Lion Chop Seal, Chinese custom Seal, Chinese Stone Seal Carving, Chinese Stone Square  Seal With Your Name Hand Engraved. ",Craft Supplies & Tools,28.99,0,2,0,0,7,0,"Craft Supplies & Tools,Stamps & Seals,Stamps,custom chinese seal,custom chinese chop,custom seal,personal  seal,name seal,stone seal stamp,personal name stamp,character chop,personalized chops,dragon carving,personalized seal,Chinese culture,seal cutting",,2019-11-19,False,False,False,SindyJoyiArts,https://www.etsy.com/listing/754487265/chinese-lion-chop-seal-chinese-custom,
"Chinese Chop Seal, Chinese custom Seal, Chinese Stone Seal Carving, Chinese Stone Square Seal With Your Name Hand Engraved. ",Craft Supplies & Tools,23.99,0,1,0,0,17,0,"Craft Supplies & Tools,Stamps & Seals,Stamps,custom chinese seal,custom chinese chop,custom seal,personal name seal,personal  seal,stone seal stamp,personal name stamp,character chop,personalized chops,dragon carving,personalized seal,seal cutting,Chinese culture",,,False,False,False,SindyJoyiArts,https://www.etsy.com/listing/746198016/chinese-chop-seal-chinese-custom-seal,
"Chinese Chop Seal, Chinese custom Seal, Chinese Stone Seal Carving, Chinese Stone Square Seal With Your Name Hand Engraved. ",Craft Supplies & Tools,21.99,0,4,0,0,10,0,"Craft Supplies & Tools,Stamps & Seals,Stamps,custom chinese seal,custom chinese chop,custom seal,personal name seal,personal  seal,stone seal stamp,personal name stamp,character chop,personalized chops,dragon carving,personalized seal,seal cutting,Chinese culture",,2019-12-21,False,False,False,SindyJoyiArts,https://www.etsy.com/listing/764089643/chinese-chop-seal-chinese-custom-seal,
Agate Chinese Name Chop With Tassel / Orange Yellow Shade / With Wooden Case and Ink Set / Hand Engraved / Calligraphy Stamping Chop ,Art & Collectibles,32.99,0,8,0,0,15,0,"Art & Collectibles,chinese chop seal,asian gift idea,customized seal,chinese gift idea,chinese artist stamp,chinese name chop,personal name seal,chinese stone seal,asian stone stamp,customized gift,personalized seal,made to order stamp,hand engraved stone",China,2020-12-01,False,False,False,CalligraphyforGod,https://www.etsy.com/listing/915382315/agate-chinese-name-chop-with-tassel,Upgrade Pro to Unlock
"Custom Chinese Mini seal pendant,Custom Japanese Name Chop Free Chinese Name Translation Stamp. ",Craft Supplies & Tools,31.99,0,1,0,0,12,0,"Craft Supplies & Tools,Stamps & Seals,Stamps,name seal,custom seal,personalized seal,personal seal,stone seal stamp,personal name stamp,dragon carving,Chinese culture,Calligraphy seal,painting,calligraphy brush,asian decor,brush set",,2021-12-26,False,False,False,SealCuttingArts,https://www.etsy.com/listing/1148101973/custom-chinese-mini-seal-pendantcustom,
"Chinese Customized couple seal, Personal Name Stamp,Custom Chinese Chop Free Chinese Name Translation Seal. ",Craft Supplies & Tools,40.99,0,1,0,0,9,0,"Craft Supplies & Tools,Stamps & Seals,Stamps,name seal,custom seal,personalized seal,personal seal,stone seal stamp,personal name stamp,dragon carving,Chinese culture,Calligraphy seal,painting,calligraphy brush,asian decor,brush set",,,False,False,False,SealCuttingArts,https://www.etsy.com/listing/1318819365/chinese-customized-couple-seal-personal,
"Chinese   Chop Seal, Chinese custom Seal, Chinese Stone Seal Carving, Chinese Stone Square Seal With Your Name Hand Engraved. ",Craft Supplies & Tools,33.99,0,3,0,0,9,0,"Craft Supplies & Tools,Stamps & Seals,Stamps,custom chinese seal,custom chinese chop,custom seal,personal  seal,name seal,stone seal stamp,personal name stamp,character chop,personalized chops,dragon carving,personalized seal,Chinese culture,seal cutting",,2021-04-10,False,False,False,SindyJoyiArts,https://www.etsy.com/listing/984403638/chinese-chop-seal-chinese-custom-seal,
"Chinese Dragon Chop Seal, Chinese custom Seal, Chinese Stone Seal Carving, Chinese Stone Square Seal With Your Name Hand Engraved. ",Craft Supplies & Tools,35.99,0,2,0,0,4,0,"Craft Supplies & Tools,Stamps & Seals,Stamps,custom chinese seal,custom chinese chop,custom seal,personal name seal,personal  seal,stone seal stamp,personal name stamp,character chop,personalized chops,dragon carving,personalized seal,seal cutting,Chinese culture",,2021-05-26,False,False,False,SindyJoyiArts,https://www.etsy.com/listing/1025936253/chinese-dragon-chop-seal-chinese-custom,
"Chinese Name Seal, Personal Name Stamp,Custom Chinese Chop Free Chinese Name Translation Seal. ",Craft Supplies & Tools,29.99,0,5,0,0,11,0,"Craft Supplies & Tools,Stamps & Seals,Stamps,chinese seal custom,name seal,chinese seal,dragon Stamps,chinese chop,Stamps,custom chinese chop,Chinese culture,custom chinese seal,stone engraving,chinese engraving,seal engraving,Private Seals",,2021-05-10,False,False,False,SealCuttingArts,https://www.etsy.com/listing/1002704992/chinese-name-seal-personal-name,
1 piece of Chinese seal Natural agate Custom birthday gift Handmade stone stamp by chisel carve Name chop calligraphy painting E129 ,Craft Supplies & Tools,35,0,0,0,0,4,0,"chinese chop,chinese name chop,chinese name seal,chinese name stamp,chinese seal,chinese stamp,custom chinese seal,custom chinese stamp,seal carving,chinese seal stone,chop seal,custom chinese chop,chop stamp custom",China,2019-02-14,False,False,False,salientstone,https://www.etsy.com/listing/683089393/1-piece-of-chinese-seal-natural-agate,Upgrade Pro to Unlock
"Custom  Name Seal, Stone Seal Carving, Chinese Stone Square Seal With Your Name Hand Engraved, Custom Made Seal Set ",Craft Supplies & Tools,37.99,0,1,0,0,3,0,"custom chinese seal,custom seal,personal name seal,stone seal stamp,personal name stamp,character chop,dragon carving,seal cutting,Chinese culture,Calligraphy seal,personalized seal,custom chinese chop,personalized chops",,,False,False,False,SindyJoyiArts,https://www.etsy.com/listing/1410586429/custom-name-seal-stone-seal-carving,
Ancient Chinese Seal Kit Carved Shoushan Stone Chop Stamp With Red Ink In Porcelain Dish PEGGY Chinese Name Stamp ,Art & Collectibles > Collectibles > Figurines & Knick Knacks,75,0,4,0,0,8,0,"Chinese chop kit,Chinese Seals,Vintage Chinese Art,Antique Chinese Art,Red and gold box,Ancient seal kit,Shoushan Stone seals,Chinese Stamp Set,Oriental Seals Chops,Chinese name stamps,Chinese name seals,Chinese Seal kit,Chinese Peggy Seal",,2020-02-08,False,False,False,Purana,https://www.etsy.com/listing/763276282/ancient-chinese-seal-kit-carved-shoushan,
"Chinese Rose Quartz Chop Seal, Chinese custom Seal, Chinese Stone Seal Carving, Chinese Stone Square Seal With Your Name Hand Engraved. ",Craft Supplies & Tools,31.99,0,1,0,0,16,0,"custom seal,personal name seal,stone seal stamp,personal name stamp,character chop,dragon carving,personalized seal,seal cutting,Chinese culture,custom chinese seal,custom chinese chop,personal  seal,personalized chops",,,False,False,False,SindyJoyiArts,https://www.etsy.com/listing/796713775/chinese-rose-quartz-chop-seal-chinese,
"Chinese Name Seal, Chinese custom Seal Carving, Chinese Seal With Your Name set Wood Gift box for Painting Calligraphy ",Craft Supplies & Tools,27.99,0,1,0,0,15,0,"custom chinese seal,custom seal,name seal,stone seal stamp,personal name stamp,character chop,dragon carving,personalized seal,Chinese culture,seal cutting,custom chinese chop,personal  seal,personalized chops",,,False,False,False,SindyJoyiArts,https://www.etsy.com/listing/744794495/chinese-name-seal-chinese-custom-seal,
2 Pieces of Chinese Seal Agate Stone Necklace Pendant Stamp Keychain String Custom Carve Name Chop Calligraphy Painting birthday gift E196 ,Craft Supplies & Tools,32,0,0,0,0,2,0,"Craft Supplies & Tools,Stamps & Seals,Stamps,birthday,enrollment,graduation,wedding,engagement,teacher,colleague,boss,classmate,new couple,printing,ceramic craft,clay",China,,False,False,False,salientstone,https://www.etsy.com/listing/672655854/2-pieces-of-chinese-seal-agate-stone,Upgrade Pro to Unlock
"Chinese Shoushan Safflower stone Seal, Personal Name Stamp,Custom Chinese Chop Free Chinese Name Translation Seal. ",Craft Supplies & Tools,29.99,0,4,0,0,5,0,"Custom Seal,Personal Name Seal,Stone Seal Stamp,Personal Name Stamp,Dragon Carving,Chinese Culture,Personalized Seal,Custom Chinese Seal,Custom Chinese Chop,Character Chop,Personalized Chops,Seal Cutting,Calligraphy Seal,Gifts for Friends,Personalized Gifts,Gifts",United States,2021-09-16,False,False,False,SindyJoyiArts,https://www.etsy.com/listing/1071312138/chinese-shoushan-safflower-stone-seal,Upgrade Pro to Unlock
3 Piece of Chinese Seal Custom Birthday Gift Handmade Stone Stamp by Chisel Carve Character Kanji Name Chop for Calligraphy Painting E276 ,Craft Supplies & Tools,40,0,0,0,0,6,0,"Birthday,Enrollment,Graduation,Wedding,Engagement,Square,Round,Rectangle,Book,Collection,Cloth,Canvas,Name Card,Birthday Gifts,Gifts for Friends,Gifts for Teachers,Personalized Gifts,Gifts",United States,2019-03-12,False,False,False,salientstone,https://www.etsy.com/listing/676080732/3-piece-of-chinese-seal-custom-birthday,Upgrade Pro to Unlock
"Beginner seal cutting tools, used for practicing seal draft, 2*2cm wood plate impression. ",Craft Supplies & Tools,16.99,0,1,0,0,15,0,"Custom Chinese Seal,Custom Seal,Personal Seal,Name Seal,Personal Name Stamp,Dragon Carving,Personalized Seal,Chinese Culture,Seal Cutting,Custom Chinese Chop,Stone Seal Stamp,Character Chop,Personalized Chops,Gifts for Friends,Personalized Gifts,Gifts",United States,,False,False,False,SindyJoyiArts,https://www.etsy.com/listing/843972926/beginner-seal-cutting-tools-used-for,Upgrade Pro to Unlock
Artisanal Stone Seal: Intricately Carved Four-Armed Guan Yin Bodhisattva/Natural Stone Seal/Artist Chop ,Craft Supplies & Tools,422.55,0,0,0,0,2,0,"Stone Stamp,Personalized Stamp,Chinese Stamp,Self Inking Stamp,Stone Seal,Gift for Him,Logo Stamp,Stamp Design,Stamps Custom,Private Seal,Stamper,Chinese Artist Chop,Natural Stone Stamp,Gifts for Boyfriend,Gifts for Dad,Gifts for Husband,Gifts for Him,Personalized Gifts,Gifts",British,,False,False,False,TreVincentShop,https://www.etsy.com/listing/1595010860/artisanal-stone-seal-intricately-carved,Upgrade Pro to Unlock
"Chinese Name Seal, Chinese custom Seal Carving, Chinese Seal With Your Name set Wood Gift box for Painting Calligraphy ",Craft Supplies & Tools,23.99,0,113,19,0,274,0,"Custom Chinese Seal,Custom Seal,Personal Name Stamp,Character Chop,Dragon Carving,Seal Cutting,Calligraphy Seal,Chinese Culture,Personalized Seal,Custom Chinese Chop,Personal Name Seal,Stone Seal Stamp,Personalized Chops,Gifts for Friends,Personalized Gifts,Gifts",United States,2019-11-15,False,False,False,SindyJoyiArts,https://www.etsy.com/listing/739137187/chinese-name-seal-chinese-custom-seal,Upgrade Pro to Unlock
"Brass Chinese Stamp Custom, Chinese Calligraphy Seal, Chinese Name Chop, Metal Name Seal Custom ",Craft Supplies & Tools,39.51,0,0,0,0,34,0,"Chinese Name Stamp,Chinese Name Seal,Chinese Name Chop,Metal Stamp,Name Chop,Hanko,Chinese Stamp,Chinese Chop,Chinese Stamp Custom,Chinese Seal Custom,Name Stamp Custom,Rakkhan Hanko,Custom Chop,Personalized Gifts",United States,,False,False,False,JayLamArt,https://www.etsy.com/listing/1267379506/brass-chinese-stamp-custom-chinese,Upgrade Pro to Unlock
"Chinese Calligraphy Stone Seal, Personal Name Stamp,Custom Chinese Chop Free Chinese Name Translation Seal Lion Engraving（2CM） ",Craft Supplies & Tools,28.99,0,2,0,0,22,0,"Name Seal,Custom Seal,Personalized Seal,Personal Seal,Personal Name Stamp,Dragon Carving,Chinese Culture,Calligraphy Seal,Painting,Calligraphy Brush,Asian Decor,Stone Seal Stamp,Brush Set,Personalized Gifts,Gifts",United States,,False,False,False,SealCuttingArts,https://www.etsy.com/listing/846999897/chinese-calligraphy-stone-seal-personal,Upgrade Pro to Unlock
Custom Square Japanese Hanko Chop - Gold Japanese Name Stamp - Chinese Name Stamp - Chinese Name Seal Personalized Brass Japanese Stationery ,Craft Supplies & Tools,46.99,0,2,0,0,3,0,"Japanese Stationery,Name Stamp,Japanese Hanko,Personalized Gift,Stamp With Ink,Japanese Name Stamp,Brass Stamp,Red Circle Stamp,In Japanese,Hanko Inkan Stamp,Japanese Geek,Studying Japanese,Personalized Gifts,Gifts",United States,,False,False,False,ExoticMerchantCrafts,https://www.etsy.com/listing/1226235616/custom-square-japanese-hanko-chop-gold,Upgrade Pro to Unlock
Year of the Rooster Chinese Zodiac Seal / Chinese Rooster Name Chop / 3 X 3 CM / Chinese Chop Seal / Rooster Year Birthday Gift Idea ,Craft Supplies & Tools,39.95,0,4,0,0,9,0,"Chinese Name Seal,Chinese Calendar,Hand Carved Stamp,Year of the Rooster,Seal Chop Stamp,Chinese Zodiac Seal,Custom Name Seal,Chinese Rooster Year,Asian Zodiac Rooster,Year of Rooster Seal,Rooster Year Stamp,Year of the Chicken,Rooster Year Gift,Birthday Gifts,Personalized Gifts,Gifts",United States,2020-12-01,False,False,False,CalligraphyforGod,https://www.etsy.com/listing/901494110/year-of-the-rooster-chinese-zodiac-seal,Upgrade Pro to Unlock
"Chinese Brass Customized Stamps, Personal Name Stamp,Custom Chinese Chop Free Chinese Name Translation Seal. ",Craft Supplies & Tools,42.99,0,0,0,0,0,0,"Name Seal,Custom Seal,Personalized Seal,Personal Seal,Stone Seal Stamp,Personal Name Stamp,Dragon Carving,Chinese Culture,Calligraphy Seal,Painting,Calligraphy Brush,Asian Decor,Brush Set,Personalized Gifts",United States,,False,False,False,SealCuttingArts,https://www.etsy.com/listing/1538506684/chinese-brass-customized-stamps-personal,Upgrade Pro to Unlock
"Chinese Chop Seal, Chinese custom Seal, Chinese Blue Stone Seal Carving, Chinese Stone Square Seal With Your Name Hand Engraved ",Craft Supplies & Tools,37.99,0,31,6,0,83,0,"Stone Stamp,Chinese Chop,Name Seal,Chop Stamp,Chinese Seal,Personalized Seal,Chinese Stamp,Private Seals,Square Seal,Chinese Seal Custom,Seal Chop Stamp,Engraved Stamps,Custom Chinese Chop,Gifts for Friends,Personalized Gifts,Gifts",United States,2020-12-23,False,False,False,Pimpmychair,https://www.etsy.com/listing/929826891/chinese-chop-seal-chinese-custom-seal,Upgrade Pro to Unlock
Price difference FOR ORDER ,Craft Supplies & Tools,14,0,1,4,0,0,0,"Stone Stamp,Chinese Chop,Name Seal,Chop Stamp,Chinese Seal,Personalized Seal,Chinese Stamp,Custom Chinese Chop,Private Seals,Square Seal,Chinese Seal Custom,Seal Chop Stamp,Engraved Stamps,Personalized Gifts",United States,2020-09-07,False,False,False,SemliCalligraphy,https://www.etsy.com/listing/866933885/price-difference-for-order,Upgrade Pro to Unlock
Cute Piggy Stone Seal - 2cm Chinese Stamp Chop w/. Gift Box ,Craft Supplies & Tools,24.99,0,9,0,0,17,0,"Stone Seal,Seal,Stamp,Chop,Chinese,Free Shipping,Stone Engraving,Stone,Pig,Cute Piggy,Piggy,Cute,Gifts",China,2017-12-17,False,False,False,MyLittleHand,https://www.etsy.com/listing/242133493/cute-piggy-stone-seal-2cm-chinese-stamp,Upgrade Pro to Unlock
"Chinese  Wood and Brass Chop Seal, Chinese custom Seal Carving, Chinese Seal With Your Name ",Craft Supplies & Tools,25.99,0,6,0,0,26,0,"Custom Chinese Chop,Custom Seal,Personal Seal,Stone Seal Stamp,Personal Name Stamp,Dragon Carving,Personalized Seal,Chinese Culture,Custom Chinese Seal,Personal Name Seal,Character Chop,Personalized Chops,Seal Cutting,Gifts for Friends,Personalized Gifts,Gifts",United States,,False,False,False,SindyJoyiArts,https://www.etsy.com/listing/767199947/chinese-wood-and-brass-chop-seal-chinese,Upgrade Pro to Unlock
Natural Wood Asian Name Stamp / Personal Seal Customized With Your Name / Chinese Gift Idea / With Ink Pad And Wooden Carrying Case ,Art & Collectibles,35.99,0,2,0,0,4,0,"Chinese Chop Stamp,Wooden Stamp,Asian Name Stamp,Chinese Name Chop,Chop Seal Stamp,Personal Name Seal,Wood Chop Seal,Custom Wood Seal,Name Seal Carving,Custom Chop Design,Personal Chop Seal,Chinese Wooden Chop,Chinese Wooden Seal",China,,False,False,False,CalligraphyforGod,https://www.etsy.com/listing/942296438/natural-wood-asian-name-stamp-personal,Upgrade Pro to Unlock
2.5cm Stone Seal - Chinese Blessing Word New Year Stamp Chop ,Craft Supplies & Tools,28.88,0,8,0,0,15,0,"stone seal,seal,stamp,chop,chinese,Free Shipping,Bamboo,Gifts,Stone Chop,ink pad,Bamboo Tells Peace,red paste",China,2021-02-11,False,False,False,MyLittleHand,https://www.etsy.com/listing/947236430/25cm-stone-seal-chinese-blessing-word,Upgrade Pro to Unlock
