Title,Category,"Price(""$"")",7-day sales,Total Sales,Total Reviews,7-day Reviews,Total Favorites,7-day Favorites,Tags,Ship From,Release Time,Best Seller,Etsy Pick,Raving,Store Name,Product URL,Image URL
"Custom Name Seal, Stone Seal Carving, Chinese Stone Square Seal With Your Name Hand Engraved, Custom Made Seal Set ",Craft Supplies & Tools,22.99,0,0,0,0,85,0,"Custom Chinese Seal,Stone Seal Stamp,Personal Name Stamp,Character Chop,Dragon Carving,Chinese Culture,Seal Cutting,Custom Seal,Personalized Seal,Custom Chinese Chop,Personal Name Seal,Personalized Chops,Calligraphy Seal,Gifts for Friends,Personalized Gifts,Gifts",United States,2019-09-01,False,False,False,SindyJoyiArts,https://www.etsy.com/listing/733232779/custom-name-seal-stone-seal-carving,Upgrade Pro to Unlock
"Chinese Calligraphy Stone Seal, Personal Name Stamp,Custom Chinese Chop Free Chinese Name Translation Seal Dragon Engraving（3CM）. ",Craft Supplies & Tools,23.99,0,1,0,0,11,0,"Name Seal,Custom Seal,Personalized Seal,Personal Seal,Stone Seal Stamp,Personal Name Stamp,Dragon Carving,Chinese Culture,Painting,Calligraphy Brush,Asian Decor,Brush Set,Calligraphy Seal,Personalized Gifts",United States,2020-07-30,False,False,False,SealCuttingArts,https://www.etsy.com/listing/847001529/chinese-calligraphy-stone-seal-personal,Upgrade Pro to Unlock
Chinese Ring Seal Custom Engraved / Cool Asian Gift Idea / Custom Name Chop / Chinese Stone Ring / Personalized Chinese Gift Idea / Seal ,Craft Supplies & Tools,29.95,0,51,8,0,127,0,"Chinese Name Seal,Chinese Name Chop,Carved Stone Ring,Cool Asian Gift,Unique Asian Gift,Cool Chinese Gift,Unique Chinese Gift,Unique Chinese Seal,Chinese Ring Seal,Chinese Ring Stamp,Engraved Stone Ring,Custom Name Chop,Chinese Carved Ring,Personalized Gifts,Gifts",United States,2018-09-18,False,False,False,CalligraphyforGod,https://www.etsy.com/listing/630844074/chinese-ring-seal-custom-engraved-cool,Upgrade Pro to Unlock
"Tao and Te   — Set of 2 mini stone seals, hand carved Oriental chop stamps ",Craft Supplies & Tools,145,0,1,0,0,23,0,"Chinese Chop Seal,Carved Stone Stamp,Miniature Stone Seal,Mini Chop,Taoist Gifts,Hand Carved Seals,Japan Name Seal,Chinese Stone Carved,Oriental Philosophy,Japan Inkan,Chinese Hanko,Stone Seal Carving,Lucky Stone Seal,Personalized Gifts,Gifts",Hungary,,False,False,False,AnnaVladiArt,https://www.etsy.com/listing/771092392/tao-and-te-set-of-2-mini-stone-seals,Upgrade Pro to Unlock
"禪 Zen — hand carved Oriental red stone seal, chop stamp, known in Japan as Inkan or Hanko ",Craft Supplies & Tools,145,0,2,0,0,65,0,"Chinese Chop Stamp,Japanese Chop Stamp,Zen Red Stamp,Zen Red Seal,Zen Inkan,Zen Hanko,Zen Chop Stamp,Zen Oriental Seal,Hand Carved Chop,Japanese Red Seal,Chinese Red Seal,Seal for Calligraphy,Seal for Sumi-e,Personalized Gifts",Hungary,,False,False,False,AnnaVladiArt,https://www.etsy.com/listing/854079369/chan-zen-hand-carved-oriental-red-stone,Upgrade Pro to Unlock
"Chinese Dandong stone Seal, Personal Name Stamp,Custom Chinese Chop Free Chinese Name Translation Seal. ",Craft Supplies & Tools,27.99,0,1,0,0,6,0,"Chinese Culture,Painting,Calligraphy Brush,Asian Decor,Name Seal,Custom Seal,Personalized Seal,Personal Seal,Stone Seal Stamp,Personal Name Stamp,Dragon Carving,Calligraphy Seal,Brush Set,Personalized Gifts,Gifts",United States,2022-09-17,False,False,False,SealCuttingArts,https://www.etsy.com/listing/1307281983/chinese-dandong-stone-seal-personal-name,Upgrade Pro to Unlock
Lotus Thread Line Carved Stone Seal/Custom Name Seal /Stone Seal Carving /Chinese Artist Chop/ 2.5 X 2.5 X 10cm ,Craft Supplies & Tools,98.4,0,0,0,0,3,0,"Chinese Seal,Wedding Stamp,Envelope Seal,Personalized Stamp,Gift for Him,Self Inking Stamp,Wax Seal With,Stone Stamp,Chinese Name Seal,Vintage Seal,Collectible Seal,Artist Chop,Stone Seal Chop,Gifts for Boyfriend,Gifts for Dad,Gifts for Husband,Gifts for Him,Personalized Gifts,Gifts",British,,False,False,False,TreVincentShop,https://www.etsy.com/listing/1331882587/lotus-thread-line-carved-stone,Upgrade Pro to Unlock
Dragon Stone Seal - 2.5cm Chinese Dragon Stamp Chop ,Art & Collectibles,28,0,8,0,0,27,0,"Stone Seal,Seal,Stamp,Chinese,Dragon,Chop,Dragon World,Dragon Stone Seal",China,2020-02-03,False,False,False,MyLittleHand,https://www.etsy.com/listing/761768708/dragon-stone-seal-25cm-chinese-dragon,Upgrade Pro to Unlock
"Custom  Name Seal, Stone Seal Carving, Chinese Stone Square Seal With Your Name Hand Engraved, Custom Made Seal Set ",Craft Supplies & Tools,45.99,0,0,0,0,0,0,"Dragon Carving,Personalized Seal,Custom Chinese Seal,Custom Chinese Chop,Custom Seal,Personal Name Seal,Stone Seal Stamp,Personal Name Stamp,Character Chop,Personalized Chops,Seal Cutting,Chinese Culture,Calligraphy Seal,Gifts for Friends,Personalized Gifts,Gifts",United States,,False,False,False,SindyJoyiArts,https://www.etsy.com/listing/1183747992/custom-name-seal-stone-seal-carving,Upgrade Pro to Unlock
"Custom Name Seal,Seal Carving,Chinese Seal With Your Name Hand Engraved,Custom Made Seal Set  (2.5 CM) ",Craft Supplies & Tools,35.99,0,2,0,0,21,0,"Chinese Seal,Personalized Seal,Chinese Stamp,Private Seals,Square Seal,Stone Stamp,Chinese Seal Custom,Seal Chop Stamp,Chinese Chop,Name Seal,Chop Stamp,Engraved Stamps,Custom Chinese Chop,Gifts for Friends,Personalized Gifts,Gifts",United States,2019-09-03,False,False,False,SemliCalligraphy,https://www.etsy.com/listing/733723615/custom-name-sealseal-carvingchinese-seal,Upgrade Pro to Unlock
"Chinese Dandong Green Stone Seal, Chinese custom Seal, Chinese Stone Seal Carving, Chinese Stone Circular Seal With Your Name Hand Engraved. ",Craft Supplies & Tools,28.99,0,10,0,0,50,0,"Dragon Carving,Personalized Seal,Custom Chinese Seal,Custom Chinese Chop,Custom Seal,Personal Name Seal,Personal Seal,Stone Seal Stamp,Personal Name Stamp,Character Chop,Personalized Chops,Seal Cutting,Chinese Culture,Gifts for Friends,Personalized Gifts,Gifts",United States,2020-09-27,False,False,False,SindyJoyiArts,https://www.etsy.com/listing/877383295/chinese-dandong-green-stone-seal-chinese,Upgrade Pro to Unlock
PAIR SEAL STONE 2.5x2.5x8cm Pair Hand Carved Qingtian Seal Stone Soapstone Including Brocade Gift Box Orientalartmaterial Calligraphy Supply ,Craft Supplies & Tools,28.18,0,0,0,0,55,0,"Calligraphy Painting,Chinese Calligraphy,Painting Accessory,Art Accessory,Chinese Seal Cutting,Seal Stone Soapstone,Seal Engraving,Chinese Soapstone,Qingtian Seal Stone,Name Chop Stone,Mood Seal Stone,Hand Carved Top,Gifts",United States,2018-01-03,False,False,False,Orientalartmaterial,https://www.etsy.com/listing/162952846/pair-seal-stone-25x25x8cm-pair-hand,Upgrade Pro to Unlock
"Custom  Name Seal, Stone Seal Carving, Chinese Stone Circle Seal With Your Name Hand Engraved, Custom Made Seal Set ",Craft Supplies & Tools,24.99,0,0,0,0,5,0,"Craft Supplies & Tools,Stamps & Seals,Stamps,custom chinese seal,custom chinese chop,custom seal,personal name seal,stone seal stamp,personal name stamp,character chop,personalized chops,dragon carving,seal cutting,Chinese culture,Calligraphy seal,personalized seal",,2022-02-12,False,False,False,SindyJoyiArts,https://www.etsy.com/listing/1163781596/custom-name-seal-stone-seal-carving,
"Chinese Calligraphy Seal, Personal Name Stamp,Custom Chinese Chop Free Chinese Name Translation Seal（2CM）. ",Craft Supplies & Tools,33.99,0,0,0,0,0,0,"Craft Supplies & Tools,Stamps & Seals,Stamps,name seal,custom seal,personalized seal,personal seal,stone seal stamp,personal name stamp,dragon carving,Chinese culture,Calligraphy seal,painting,calligraphy brush,asian decor,brush set",,,False,False,False,SealCuttingArts,https://www.etsy.com/listing/1254300255/chinese-calligraphy-seal-personal-name,
2 Pieces of Agate Pendant Seal Keychain Chinese Seal Cuztomized Stamp Chinese Name Chop Carve Name for Calligraphy Painting Hanko E803 ,Craft Supplies & Tools,36,0,0,0,0,0,0,"Craft Supplies & Tools,Stamps & Seals,Stamps,chinese chop,chinese name chop,chinese name seal,chinese name stamp,chinese seal,chinese stamp,custom chinese chop,custom chinese seal,custom chinese stamp,seal carving,chinese name,chinese signature,stone seal",China,2019-09-16,False,False,False,salientstone,https://www.etsy.com/listing/723208342/2-pieces-of-agate-pendant-seal-keychain,Upgrade Pro to Unlock
A Piece of 2*2*6 cm Stone Chinese Seal Customized Stamp Chop Chapter Stamper Birthday Gift E424 ,Craft Supplies & Tools,24,0,0,0,0,2,0,"Craft Supplies & Tools,Stamps & Seals,Stamps,chinese chop,chinese name chop,chinese name seal,chinese name stamp,chinese seal,chinese stamp,custom chinese chop,custom chinese seal,custom chinese stamp,seal carving,customized seal,chinese signature,customized chop",China,2019-03-29,False,False,False,salientstone,https://www.etsy.com/listing/680664514/a-piece-of-226-cm-stone-chinese-seal,Upgrade Pro to Unlock
Special Offer: 2 Piece of Chinese Seal Custom Birthday Gift Handmade Stone Stamp by Chisel Carve Name Chop for Calligraphy Painting E153 ,Craft Supplies & Tools,40,0,0,0,0,5,0,"Craft Supplies & Tools,Stamps & Seals,Stamps,chinese chop,chinese name chop,chinese name seal,chinese name stamp,chinese seal,chinese stamp,custom chinese chop,custom chinese seal,custom chinese stamp,seal carving,chinese seal stone,customized seal,stamp chop",China,,False,False,False,salientstone,https://www.etsy.com/listing/670794756/special-offer-2-piece-of-chinese-seal,Upgrade Pro to Unlock
"Custom  Name Seal, Stone Seal Carving, Chinese Stone Square Seal With Your Name Hand Engraved, Custom Made Seal Set ",Craft Supplies & Tools,46.99,0,0,0,0,2,0,"Craft Supplies & Tools,Stamps & Seals,Stamps,custom chinese seal,custom chinese chop,custom seal,personal name seal,stone seal stamp,personal name stamp,character chop,personalized chops,dragon carving,seal cutting,Chinese culture,Calligraphy seal,personalized seal",,,False,False,False,SindyJoyiArts,https://www.etsy.com/listing/1351110051/custom-name-seal-stone-seal-carving,
6*6*11 Peach Wood Lion Statue Chinese Seal Stamp Wooden Chop ,Craft Supplies & Tools,50,0,0,0,0,7,0,"Craft Supplies & Tools,Stamps & Seals,Stamps,chinese name,stone chop,stone stamp,enrollment,graduation,wedding,engagement,calligraphy,printing,anti-fake,signature,book,mother",China,,False,False,False,salientstone,https://www.etsy.com/listing/987974527/6611-peach-wood-lion-statue-chinese-seal,Upgrade Pro to Unlock
"Chinese Qingtian stone Seal, Personal Name Stamp,Custom Chinese Chop Free Chinese Name Translation Seal. ",Craft Supplies & Tools,29.99,0,0,0,0,2,0,"Craft Supplies & Tools,Stamps & Seals,Stamps,name seal,custom seal,personalized seal,personal seal,stone seal stamp,personal name stamp,dragon carving,Chinese culture,Calligraphy seal,painting,calligraphy brush,asian decor,brush set",,2020-09-27,False,False,False,SealCuttingArts,https://www.etsy.com/listing/863452672/chinese-qingtian-stone-seal-personal,
Chinese Chop Seal / Asian Seal Stamp / Red Circle  / Chinese Characters / Chinese Symbol Translated / Love / Joy / Wisdom / Qi / Blessing ,Craft Supplies & Tools,28.95,0,7,0,0,24,0,"Stamp Seal,Chinese Chop Seal,Asian Seal Stamp,Seal Chop,Love Chinese Symbol,Qi Chinese Symbol,Chinese Symbol,Chinese Character,Word in Chinese,Chinese Word Seal,Symbols Chinese,Characters Chinese,Stamp Seal Chinese,Gifts",United States,,False,False,False,CalligraphyforGod,https://www.etsy.com/listing/608401168/chinese-chop-seal-asian-seal-stamp-red,Upgrade Pro to Unlock
"Chinese Zodiac Brass Seal,Custom Name Seal,Chinese Copper Seal With Your Name Engraved,Custom Made Seal Set ",Craft Supplies & Tools,41.99,0,0,0,0,9,0,"Craft Supplies & Tools,Stamps & Seals,Stamps,custom chinese seal,custom chinese chop,custom seal,personal name seal,stone seal stamp,personal name stamp,character chop,personalized chops,dragon carving,seal cutting,Chinese culture,Calligraphy seal,personalized seal",,2022-09-01,False,False,False,SindyJoyiArts,https://www.etsy.com/listing/1297002633/chinese-zodiac-brass-sealcustom-name,
DIY White Square Stones for Engraving  Custom Carve Your Own Stone With Your Name Engrave a Logo Or A Design  Stone Stamp Blanks ,Craft Supplies & Tools,29.99,0,3,0,0,20,0,"Craft Supplies & Tools,Stamps & Seals,Seals,Square,Chinese seal clamp,Stone seal,Stone seal blank,Chinese name seal,Chinese chop,Chinese stamp,Stamp chop,Japanese chop blank,Hanko chop blank,Square seal,Square stamp,Chinese seal",United States,,False,False,False,SemliCalligraphy,https://www.etsy.com/listing/1158894670/diy-white-square-stones-for-engraving,Upgrade Pro to Unlock
"Custom Name Seal, Chinese Brass Seal With Your Name, Custom Made Seal Set ",Craft Supplies & Tools,55.99,0,0,0,0,0,0,"Craft Supplies & Tools,Stamps & Seals,Stamps,custom chinese seal,custom chinese chop,custom seal,personal name seal,stone seal stamp,personal name stamp,character chop,personalized chops,dragon carving,seal cutting,Chinese culture,Calligraphy seal,personalized seal",United States,,False,False,False,SindyJoyiArts,https://www.etsy.com/listing/1378395303/custom-name-seal-chinese-brass-seal-with,Upgrade Pro to Unlock
"China Dragon turtle seal，Chinese Name Seal, Personal Personalized  Chinese Chop Free Chinese Name Translation Seal. ",Craft Supplies & Tools,119.99,0,0,0,0,4,0,"Craft Supplies & Tools,Stamps & Seals,Stamps,name seal,custom seal,personalized seal,personal seal,stone seal stamp,personal name stamp,dragon carving,Chinese culture,Calligraphy seal,painting,calligraphy brush,asian decor,brush set",United States,,False,False,False,SealCuttingArts,https://www.etsy.com/listing/1138016668/china-dragon-turtle-sealchinese-name,Upgrade Pro to Unlock
"Custom Graduation Commemorative Seal, Personal Name Stamp,Custom Chinese Chop Free Chinese Name Translation Seal. ",Craft Supplies & Tools,33.99,0,4,0,0,38,0,"Craft Supplies & Tools,Stamps & Seals,Stamps,name seal,custom seal,personalized seal,personal seal,stone seal stamp,personal name stamp,dragon carving,Chinese culture,Calligraphy seal,painting,calligraphy brush,asian decor,brush set",United States,2022-07-17,False,False,False,SealCuttingArts,https://www.etsy.com/listing/1255708502/custom-graduation-commemorative-seal,Upgrade Pro to Unlock
"Chinese Shoushan stone Stone Seal, Personal Name Stamp,Custom Chinese Chop Free Chinese Name Translation Seal. ",Craft Supplies & Tools,34.99,0,0,0,0,2,0,"Craft Supplies & Tools,Stamps & Seals,Stamps,name seal,custom seal,personalized seal,personal seal,stone seal stamp,personal name stamp,dragon carving,Chinese culture,Calligraphy seal,painting,calligraphy brush,asian decor,brush set",United States,,False,False,False,SealCuttingArts,https://www.etsy.com/listing/1011945406/chinese-shoushan-stone-stone-seal,Upgrade Pro to Unlock
Square 2.5cm Stone Seal - Chinese [Flower Blooming] Stamp Chop w/. Gift Box ,Craft Supplies & Tools,49.99,0,2,0,0,15,0,"Craft Supplies & Tools,Stamps & Seals,Seals,Sealing Stamps,stone seal,seal,stamp,chop,chinese,Free Shipping,Gifts,Stone Chop,red paste,ink pad,Flower Blooming",China,,False,False,False,MyLittleHand,https://www.etsy.com/listing/510013446/square-25cm-stone-seal-chinese-flower,Upgrade Pro to Unlock
"Chiese Barss Seals, Custom Name Seal, Chinese  Square Seal With Your Name Hand Engraved. ",Craft Supplies & Tools,38.99,0,0,0,0,3,0,"Craft Supplies & Tools,Stamps & Seals,Stamps,custom chinese seal,custom chinese chop,custom seal,personal name seal,personal  seal,stone seal stamp,personal name stamp,character chop,personalized chops,dragon carving,personalized seal,seal cutting,Chinese culture",,,False,False,False,SindyJoyiArts,https://www.etsy.com/listing/1255184824/chiese-barss-seals-custom-name-seal,
"Chinese Shoushan  stone Seal, Personal Name Stamp,Custom Chinese Chop Free Chinese Name Translation Seal. ",Craft Supplies & Tools,26.99,0,0,0,0,4,0,"Craft Supplies & Tools,Stamps & Seals,Stamps,custom chinese seal,custom chinese chop,custom seal,personal name seal,stone seal stamp,personal name stamp,character chop,personalized chops,dragon carving,seal cutting,Calligraphy seal,Chinese culture,personalized seal",,,False,False,False,SindyJoyiArts,https://www.etsy.com/listing/1085252457/chinese-shoushan-stone-seal-personal,
2 Manmade Opal Column Pillar Chinese Seal Stamp Chop Custom Birthday Gift  Chisel Carve Name Calligraphy Painting Collection Signature E197 ,Craft Supplies & Tools,30,0,0,0,0,2,0,"Craft Supplies & Tools,Stamps & Seals,Stamps,birthday,graduation,wedding,engagement,book,collection,anti-fake,signature,teacher,calligraphy,printing,name card,enrollment",China,,False,False,False,salientstone,https://www.etsy.com/listing/686699589/2-manmade-opal-column-pillar-chinese,Upgrade Pro to Unlock
"Custom  Name Seal, Stone Seal Carving, Chinese Stone Square Seal With Your Name Hand Engraved, Custom Made Seal Set ",Craft Supplies & Tools,46.99,0,0,0,0,5,0,"Craft Supplies & Tools,Stamps & Seals,Stamps,custom chinese seal,custom chinese chop,custom seal,personal name seal,stone seal stamp,personal name stamp,character chop,personalized chops,dragon carving,seal cutting,Chinese culture,Calligraphy seal,personalized seal",,,False,False,False,SindyJoyiArts,https://www.etsy.com/listing/1246902088/custom-name-seal-stone-seal-carving,
"Chinese Mother and child PIUXIU Seal,Custom Name Seal, Chinese Stone Square Seal With Your Name Hand Engraved, Custom Made Seal Set ",Craft Supplies & Tools,32.99,0,0,0,0,9,0,"Craft Supplies & Tools,Stamps & Seals,Stamps,custom chinese seal,custom chinese chop,custom seal,personal name seal,stone seal stamp,personal name stamp,character chop,personalized chops,dragon carving,seal cutting,Chinese culture,Calligraphy seal,personalized seal",,2021-12-26,False,False,False,SindyJoyiArts,https://www.etsy.com/listing/1148089945/chinese-mother-and-child-piuxiu,
"Chinese Shoushan Stone Calligraphy Seal, Personal Name Stamp,Custom Chinese Chop Free Chinese Name Translation Seal. ",Craft Supplies & Tools,24.99,0,0,0,0,2,0,"Craft Supplies & Tools,Stamps & Seals,Stamps,name seal,custom seal,personalized seal,personal seal,stone seal stamp,personal name stamp,dragon carving,Chinese culture,Calligraphy seal,painting,calligraphy brush,asian decor,brush set",,,False,False,False,SealCuttingArts,https://www.etsy.com/listing/1271324476/chinese-shoushan-stone-calligraphy-seal,
"Chinese Chop Seal, Chinese custom Seal, Chinese Stone  Seal Carving, Chinese Stone Square Seal With Your Name Hand Engraved. ",Craft Supplies & Tools,25.99,0,1,0,0,13,0,"Craft Supplies & Tools,Stamps & Seals,Stamps,custom chinese seal,custom chinese chop,custom seal,personal  seal,name seal,stone seal stamp,personal name stamp,character chop,personalized chops,dragon carving,personalized seal,Chinese culture,seal cutting",,,False,False,False,SindyJoyiArts,https://www.etsy.com/listing/761654085/chinese-chop-seal-chinese-custom-seal,
"Learning Chinese Seal Cutting Book,Seal Carving Book,Chinese Calligraphy Book ",Craft Supplies & Tools,20.99,0,0,0,0,9,0,"Craft Supplies & Tools,Stamps & Seals,Stamps,custom chinese seal,custom chinese chop,custom seal,personal name seal,stone seal stamp,personal name stamp,character chop,personalized chops,dragon carving,seal cutting,Chinese culture,Calligraphy seal,personalized seal",,,False,False,False,SindyJoyiArts,https://www.etsy.com/listing/1467264118/learning-chinese-seal-cutting-bookseal,
"Chinese custom Silver Gourd Seal, Key Chain Pendant, Lovely Men and Women Pendant, Creative Gifts. ",Craft Supplies & Tools,53.99,0,0,0,0,17,0,"Craft Supplies & Tools,Stamps & Seals,Stamps,custom chinese seal,custom chinese chop,custom seal,personal name seal,stone seal stamp,personal name stamp,character chop,personalized chops,dragon carving,seal cutting,Chinese culture,Calligraphy seal,personalized seal",,2022-03-16,False,False,False,SindyJoyiArts,https://www.etsy.com/listing/1183742060/chinese-custom-silver-gourd-seal-key,
"Custom Name Seal, Stone Seal Carving, Chinese Stone Square Seal With Your Name Hand Engraved, Custom Made Seal Set ",Craft Supplies & Tools,33.99,0,0,0,0,5,0,"Craft Supplies & Tools,Stamps & Seals,Stamps,custom chinese seal,custom chinese chop,custom seal,personal name seal,personal  seal,stone seal stamp,personal name stamp,character chop,personalized chops,dragon carving,personalized seal,seal cutting,Chinese culture",,2022-02-17,False,False,False,SindyJoyiArts,https://www.etsy.com/listing/1181060655/custom-name-seal-stone-seal-carving,
"Chinese Coloured pottery Chop Seal, Chinese custom Seal, Chinese Stone Seal Carving, Chinese Stone Square Seal With Your Name Hand Engraved. ",Craft Supplies & Tools,26.99,0,3,0,0,5,0,"Craft Supplies & Tools,Stamps & Seals,Stamps,custom chinese seal,custom chinese chop,custom seal,personal name seal,personal  seal,stone seal stamp,personal name stamp,character chop,personalized chops,dragon carving,personalized seal,seal cutting,Chinese culture",,2020-03-20,False,False,False,SindyJoyiArts,https://www.etsy.com/listing/788251659/chinese-coloured-pottery-chop-seal,
Chinese Clay Seal / Chinese Pottery Seal / Ancient Chinese Sealing Stamp / Custom Clay Stamp / Pottery Custom Seal / Chinese Gift Idea ,Craft Supplies & Tools,35.95,0,3,0,0,8,0,"Craft Supplies & Tools,Stamps & Seals,Stamps,Chinese pottery seal,pottery custom seal,clay custom stamp,clay custom chop,custom clay stamp,Chinese clay chop,Chinese gift idea,ancient chinese seal,unique clay seal,pottery seal stamp,molded clay stamp,molded clay seal,ceramic seal",China,2019-08-26,False,False,False,CalligraphyforGod,https://www.etsy.com/listing/717862260/chinese-clay-seal-chinese-pottery-seal,Upgrade Pro to Unlock
"Chinese  Chop Seal, Chinese custom Seal, Chinese Stone Seal Carving, Chinese Stone Square Seal With Your Name Hand Engraved. ",Craft Supplies & Tools,34.99,0,2,0,0,7,0,"Craft Supplies & Tools,Stamps & Seals,Stamps,custom chinese seal,custom chinese chop,custom seal,personal name seal,personal  seal,stone seal stamp,personal name stamp,character chop,personalized chops,dragon carving,personalized seal,seal cutting,Chinese culture",,2020-06-02,False,False,False,SindyJoyiArts,https://www.etsy.com/listing/818026313/chinese-chop-seal-chinese-custom-seal,
2 CM Square / Engraved Dragon Chinese Chop / Stone Stamping Seal / Personalize With Your Name ,Craft Supplies & Tools,29.95,0,2,0,0,3,0,"Craft Supplies & Tools,Stamps & Seals,Stamps,chinese seal,chinese chop,chinese stamp,stone engraving,chinese engraving,stone seal,seal engraving,carved seal,dragon seal,dragon chop,chinese dragon,name in chinese,chinese chop seal",China,,False,False,False,CalligraphyforGod,https://www.etsy.com/listing/1063973708/2-cm-square-engraved-dragon-chinese-chop,Upgrade Pro to Unlock
2 X 2 CM Personal Name Seal Carving / Name in Chinese / Engraved Chinese Characters / Classic Chinese Seal Stamp / Square ,Craft Supplies & Tools,27.95,0,2,0,0,8,0,"Craft Supplies & Tools,Stamps & Seals,Stamps,classic chinese chop,Chinese chop set,red Chinese chop,red Chinese stamp,stone seals,Chinese chops,Chinese chops stamps,soapstone seal,chinese stone seal,chinese calligraphy,Chinese gift,name in chinese,name seal stamp",China,,False,False,False,CalligraphyforGod,https://www.etsy.com/listing/1188147559/2-x-2-cm-personal-name-seal-carving-name,Upgrade Pro to Unlock
"Chinese Natural Red Stone Seal, Personal Name Stamp,Custom Chinese Chop Free Chinese Name Translation Seal. ",Craft Supplies & Tools,39.99,0,0,0,0,0,0,"Craft Supplies & Tools,Stamps & Seals,Stamps,name seal,custom seal,personalized seal,personal seal,stone seal stamp,personal name stamp,dragon carving,Chinese culture,Calligraphy seal,painting,calligraphy brush,asian decor,brush set",,,False,False,False,SealCuttingArts,https://www.etsy.com/listing/1282980348/chinese-natural-red-stone-seal-personal,
A Piece of Finished Chinese Seal Custom Stone Stamp Chisel Carve Name Signature Chop for Calligraphy Painting Hanko E162 ,Craft Supplies & Tools,28,0,2,0,0,19,0,"Craft Supplies & Tools,Stamps & Seals,Stamps,wedding,new couple,birthday,yellow,stone,teacher,imprint,signature,book,collection,name card,blog,icon",China,,False,False,False,salientstone,https://www.etsy.com/listing/671353046/a-piece-of-finished-chinese-seal-custom,Upgrade Pro to Unlock
"Chinese Wood and stone Seal, Personal Name Stamp,Custom Chinese Chop Free Chinese Name Translation Seal. ",Craft Supplies & Tools,37.99,0,1,0,0,4,0,"Craft Supplies & Tools,Stamps & Seals,Stamps,name seal,custom seal,personalized seal,personal seal,stone seal stamp,personal name stamp,dragon carving,Chinese culture,Calligraphy seal,painting,calligraphy brush,asian decor,brush set",,2021-05-15,False,False,False,SealCuttingArts,https://www.etsy.com/listing/1019621287/chinese-wood-and-stone-seal-personal,
Stone Seal - 2.5cm Chinese Zodiac (Rat / Mouse Year) Stamp Chop ,Art & Collectibles,26.88,0,5,0,0,9,0,"Art & Collectibles,stone seal,seal,stamp,chop,chinese,Name,Name Chop,Chinese Zodiac,Rat,Mouse,2020",China,2019-10-22,False,False,False,MyLittleHand,https://www.etsy.com/listing/746685945/stone-seal-25cm-chinese-zodiac-rat-mouse,Upgrade Pro to Unlock
"Chinese Qintian Stone Seal, Personal Name Stamp,Custom Chinese Chop Free Chinese Name Translation Seal（1.5CM）. ",Craft Supplies & Tools,31.99,0,1,0,0,16,0,"Craft Supplies & Tools,Stamps & Seals,Stamps,name seal,custom seal,personalized seal,personal seal,stone seal stamp,personal name stamp,dragon carving,Chinese culture,Calligraphy seal,painting,calligraphy brush,asian decor,brush set",,2020-11-25,False,False,False,SealCuttingArts,https://www.etsy.com/listing/897346826/chinese-qintian-stone-seal-personal-name,
