Title,Category,"Price(""$"")",7-day sales,Total Sales,Total Reviews,7-day Reviews,Total Favorites,7-day Favorites,Tags,Ship From,Release Time,Best Seller,Etsy Pick,Raving,Store Name,Product URL,Image URL
"Wooden Seals, Personal Signature Seals, Name Seal Seals, Mahogany Seals, Calligraphy Seals, Four Treasures of the Study Seals, Gifts ",Craft Supplies & Tools,30.48,0,0,0,0,0,0,"Name Stamp,Personalized Stamp,Wood Name Sign,Name Seal,Name Chop,Seal Stamp,Japanese Name Seal,Japanese Name Stamp,Chinese Name,Korean Name Stamp,Gifts,Wooden Stamps,Seals,Personalized Gifts,Gifts",China,,False,False,False,CopingGifts,https://www.etsy.com/listing/1444321355/wooden-seals-personal-signature-seals,Upgrade Pro to Unlock
"Custom Chinese name stamp, calligraphy seal, ebony wood Chinese seal, keychain pendant, name stamp, gift for calligraphers ",Craft Supplies & Tools,38.28,0,0,0,0,2,0,"Calligraphy Stamp,Chinese Name Seal,Name Chop,Stamps,Chinese Name Chop,Calligraphy Seal,Chop Seal,Chinese Stamp Custom,Name Chop Dragon,Name Stamp Dragon,Name Chop Custom,Chinese Chop Custom,Calligraphy Chop,Personalized Gifts,Gifts",China,,False,False,False,CopingGifts,https://www.etsy.com/listing/1439093321/custom-chinese-name-stamp-calligraphy,Upgrade Pro to Unlock
"Chinese Agate Stone Seal, Personal Name Stamp,Custom Chinese Chop Free Chinese Name Translation Seal（1.5CM）. ",Craft Supplies & Tools,22.99,0,2,0,0,20,0,"Name Seal,Custom Seal,Personalized Seal,Personal Seal,Personal Name Stamp,Dragon Carving,Chinese Culture,Calligraphy Seal,Painting,Calligraphy Brush,Asian Decor,Brush Set,Stone Seal Stamp,Personalized Gifts,Gifts",United States,2020-08-07,False,False,False,SealCuttingArts,https://www.etsy.com/listing/851101213/chinese-agate-stone-seal-personal-name,Upgrade Pro to Unlock
"Custom Qingtian Stone Gourd Name Seal , Stone Seal Carving, Chinese Stone  Seal With Your Name Hand Engraved, Custom Made Seal Set. ",Craft Supplies & Tools,35.99,0,1,0,0,14,0,"Custom Chinese Seal,Custom Seal,Personal Name Seal,Personal Name Stamp,Dragon Carving,Chinese Culture,Calligraphy Seal,Personalized Seal,Custom Chinese Chop,Stone Seal Stamp,Character Chop,Personalized Chops,Seal Cutting,Gifts for Friends,Personalized Gifts,Gifts",United States,,False,False,False,SindyJoyiArts,https://www.etsy.com/listing/1364375558/custom-qingtian-stone-gourd-name-seal,Upgrade Pro to Unlock
"Custom Chinese Name Seal,Custom Japanese Name Chop Free Chinese Name Translation Stamp(various patten) ",Craft Supplies & Tools,33.99,0,1,0,0,7,0,"Name Seal,Custom Seal,Personalized Seal,Personal Seal,Personal Name Stamp,Dragon Carving,Chinese Culture,Calligraphy Seal,Painting,Calligraphy Brush,Asian Decor,Brush Set,Stone Seal Stamp,Personalized Gifts",United States,2021-11-28,False,False,False,SealCuttingArts,https://www.etsy.com/listing/1129856863/custom-chinese-name-sealcustom-japanese,Upgrade Pro to Unlock
"Chinese Qintian Stone Seal, Personal Name Stamp,Custom Chinese Chop Free Chinese Name Translation Seal（2.5CM）. ",Craft Supplies & Tools,23.99,0,0,0,0,8,0,"Name Seal,Custom Seal,Personalized Seal,Personal Seal,Personal Name Stamp,Dragon Carving,Chinese Culture,Calligraphy Seal,Painting,Calligraphy Brush,Asian Decor,Brush Set,Stone Seal Stamp,Personalized Gifts",United States,2020-08-20,False,False,False,SealCuttingArts,https://www.etsy.com/listing/843861904/chinese-qintian-stone-seal-personal-name,Upgrade Pro to Unlock
"Custom  Name Seal, Stone Seal Carving, Chinese Stone Square Seal With Your Name Hand Engraved, Custom Made Seal Set ",Craft Supplies & Tools,37.99,0,0,0,0,0,0,"Custom Chinese Chop,Custom Seal,Stone Seal Stamp,Personal Name Stamp,Dragon Carving,Seal Cutting,Chinese Culture,Calligraphy Seal,Personalized Seal,Custom Chinese Seal,Personal Name Seal,Character Chop,Personalized Chops,Gifts for Friends,Personalized Gifts,Gifts",United States,,False,False,False,SindyJoyiArts,https://www.etsy.com/listing/1311854667/custom-name-seal-stone-seal-carving,Upgrade Pro to Unlock
"Chinese Good Lucky Seal,Custom Name Seal,Seal Carving,Chinese Seal With Your Name Hand Engraved,Custom Made Seal Set. ",Craft Supplies & Tools,29.99,0,5,0,0,5,0,"Custom Chinese Chop,Custom Seal,Stone Seal Stamp,Personal Name Stamp,Dragon Carving,Seal Cutting,Calligraphy Seal,Chinese Culture,Personalized Seal,Custom Chinese Seal,Personal Name Seal,Character Chop,Personalized Chops,Gifts for Friends,Personalized Gifts,Gifts",United States,2021-05-09,False,False,False,SindyJoyiArts,https://www.etsy.com/listing/1002128322/chinese-good-lucky-sealcustom-name,Upgrade Pro to Unlock
"Chinese Shoushan Stone Seal, Chinese custom Seal, Chinese Stone Seal Carving, Chinese Stone Square Seal With Your Name Hand Engraved. ",Craft Supplies & Tools,28.99,0,0,0,0,13,0,"Craft Supplies & Tools,Stamps & Seals,Stamps,custom chinese seal,custom chinese chop,custom seal,personal name seal,personal  seal,stone seal stamp,personal name stamp,character chop,personalized chops,dragon carving,personalized seal,seal cutting,Chinese culture",,2020-08-13,False,False,False,SindyJoyiArts,https://www.etsy.com/listing/839762656/chinese-shoushan-stone-seal-chinese,
Unique Chinese Gift / Chinese Teacher Gift / Engraved Chinese Seal / Personalize With Name In Chinese / Chinese Student Gift / Gift For Him ,Craft Supplies & Tools,42.95,0,17,0,0,29,0,"Chinese Gift for Her,Chinese Graduation,Gift for Chinese,Cool Gift,Chinese Seal Stamp,Chinese Chop Seal,Unique Chinese Gift,Fun Chinese Gift,Chinese Gift for Him,Chinese Teacher Gift,Asian Gift,Chinese Student Gift,Engraved Seal Chop,Gifts for Boyfriend,Gifts for Dad,Gifts for Girlfriend,Gifts for Husband,Gifts for Mom,Gifts for Sister,Gifts for Wife,Gifts for Her,Gifts for Him,Gifts for Teachers,Personalized Gifts,Gifts",United States,2021-07-23,False,False,False,CalligraphyforGod,https://www.etsy.com/listing/629452892/unique-chinese-gift-chinese-teacher-gift,Upgrade Pro to Unlock
2.5cm Chinese Stone Seal - Rabbit Bunny Lover Flower Viewing Stamp Chop ,Craft Supplies & Tools,28,0,8,0,0,48,0,"Stone Seal,Seal,Stamp,Chop,Chinese,Love,Bunny,Rabbit,Moon,12 Zodiac,Moon Rabbit,Mid-autumn Festival,Rabbit Stone Seal",China,,False,False,False,MyLittleHand,https://www.etsy.com/listing/632467947/25cm-chinese-stone-seal-rabbit-bunny,Upgrade Pro to Unlock
Chinese Stone Seal Set - The Moon Story (Chang'e & Rabbit Bunny) Stamp Chop w/. Gift Box ,Craft Supplies & Tools,55,0,7,0,0,44,0,"Stone Seal,Seal,Stamp,Chop,Chinese,Free Shipping,Goddess of the Moon,Moon,Chinese Festival,Easter,Chinese God,Mid-autumn Festival,Mid-autumn,Gifts",China,2017-04-03,False,False,False,MyLittleHand,https://www.etsy.com/listing/522536243/chinese-stone-seal-set-the-moon-story,Upgrade Pro to Unlock
Young Monk Chinese seal Custom Hanko birthday gift stone stamp by chisel carve Name chop for calligraphy painting E088 ,Craft Supplies & Tools,30,0,1,0,0,12,0,"Chinese Chop,Chinese Name Chop,Chinese Name Seal,Chinese Name Stamp,Chinese Seal,Chinese Stamp,Seal Carving,Chinese Name,Chop Seal,Seal Stamp,Custom Chinese Chop,Custom Chinese Seal,Custom Chinese Stamp,Birthday Gifts,Gifts for Friends,Gifts for Teachers,Personalized Gifts,Gifts",United States,2019-01-30,False,False,False,salientstone,https://www.etsy.com/listing/665177748/young-monk-chinese-seal-custom-hanko,Upgrade Pro to Unlock
Moon Rabbit Stone Seal - 2cm Rabbit Playing Under the Moon Stamp Chop ,Craft Supplies & Tools,24.99,0,4,0,0,22,0,"Stone Seal,Seal,Stamp,Chop,Chinese,Love,Bunny,Rabbit,Moon,12 Zodiac,Mid-autumn Festival,Rabbit Stone Seal",China,,False,False,False,MyLittleHand,https://www.etsy.com/listing/656748162/moon-rabbit-stone-seal-2cm-rabbit,Upgrade Pro to Unlock
Custom Square Japanese Hanko Chop - Green Jade Japanese Name Stamp - Chinese Name Stamp - Name Seal - Personalized Japanese Stone Stationery ,Craft Supplies & Tools,54.99,0,5,0,0,13,0,"Japanese Stationery,Name Stamp,Japanese Hanko,Personalized Gift,Stamp With Ink,Japanese Name Stamp,Wooden Stamp,Red Circle Stamp,In Japanese,Hanko Inkan Stamp,Japanese Geek,Studying Japanese,Personalized Gifts,Gifts",United States,,False,False,False,ExoticMerchantCrafts,https://www.etsy.com/listing/1304024191/custom-square-japanese-hanko-chop-green,Upgrade Pro to Unlock
Custom Square Japanese Hanko Chop - White Japanese Name Stamp - Chinese Name Stamp - Name Seal - Personalized Japanese Stationery ,Craft Supplies & Tools,24.99,0,11,4,0,64,0,"Japanese Stationery,Name Stamp,Japanese Hanko,Personalized Gift,Stamp With Ink,Japanese Name Stamp,Wooden Stamp,Red Circle Stamp,In Japanese,Hanko Inkan Stamp,Japanese Geek,Studying Japanese,Personalized Gifts,Gifts",United States,2022-06-27,False,False,False,ExoticMerchantCrafts,https://www.etsy.com/listing/1258578633/custom-square-japanese-hanko-chop-white,Upgrade Pro to Unlock
A Piece of 2*2*5 cm Stone Chinese Seal Customized Stamp Chop Chapter Stamper Birthday Gift E457 ,Craft Supplies & Tools,30,0,0,0,0,2,0,"Chinese Chop,Chinese Name Chop,Chinese Name Seal,Chinese Name Stamp,Chinese Seal,Chinese Stamp,Custom Chinese Seal,Seal Carving,Customized Seal,Custom Chinese Chop,Custom Chinese Stamp,Chinese Signature,Customized Chop,Birthday Gifts,Gifts for Friends,Gifts for Teachers,Personalized Gifts,Gifts",United States,2019-04-05,False,False,False,salientstone,https://www.etsy.com/listing/682485368/a-piece-of-225-cm-stone-chinese-seal,Upgrade Pro to Unlock
Vintage Chinese Chop Boxed Set - Carved Stone Signature Seal Stamp ‘Mallory’ - Porcelain Dragon Ink Pot - YinJian - Carved Soapstone ,Craft Supplies & Tools,69.55,0,0,0,0,0,0,"Chinese Chop,Carved Soapstone,Stone Stamp,Carved Stone Stamp,Boxed Chop Set,Signature Seal Stamp,Mallory Signature,Porcelain Ink Pot,Dragon Ink Pot,Yinjian Boxed Set,Vintage Chop Set,Asian Collectible,Red Mud Ink",United States,,False,False,False,cloverhollowvintage,https://www.etsy.com/listing/1276316153/vintage-chinese-chop-boxed-set-carved,Upgrade Pro to Unlock
"Custom Name Seal,Brass Rabbit Seal Carving,Chinese Copper Round Seal With Your Name Engraved,Custom Made Seal Set ",Craft Supplies & Tools,41.99,0,1,0,0,19,0,"Custom Seal,Dragon Carving,Seal Cutting,Chinese Culture,Personalized Seal,Custom Chinese Seal,Custom Chinese Chop,Personal Name Seal,Stone Seal Stamp,Personal Name Stamp,Character Chop,Personalized Chops,Calligraphy Seal,Gifts for Friends,Personalized Gifts,Gifts",United States,,False,False,False,SindyJoyiArts,https://www.etsy.com/listing/1431592325/custom-name-sealbrass-rabbit-seal,Upgrade Pro to Unlock
"Chinese Shoushan ston Seal, Personal Name Stamp,Custom Chinese Chop Free Chinese Name Translation Seal. ",Craft Supplies & Tools,34.99,0,0,0,0,0,0,"Name Seal,Custom Seal,Personalized Seal,Personal Seal,Dragon Carving,Chinese Culture,Painting,Calligraphy Brush,Asian Decor,Brush Set,Stone Seal Stamp,Personal Name Stamp,Calligraphy Seal,Personalized Gifts",United States,,False,False,False,SealCuttingArts,https://www.etsy.com/listing/1461287855/chinese-shoushan-ston-seal-personal-name,Upgrade Pro to Unlock
"Chinese Custom Name Seal, Personal Name Stamp,Custom Chinese Chop Free Chinese Name Translation Seal. ",Craft Supplies & Tools,46.99,0,0,0,0,8,0,"Name Seal,Custom Seal,Personalized Seal,Personal Seal,Dragon Carving,Chinese Culture,Painting,Calligraphy Brush,Asian Decor,Brush Set,Stone Seal Stamp,Personal Name Stamp,Calligraphy Seal,Personalized Gifts",United States,,False,False,False,SealCuttingArts,https://www.etsy.com/listing/1392695719/chinese-custom-name-seal-personal-name,Upgrade Pro to Unlock
"Chinese  Wood and Brass Chop Seal, Chinese custom Seal Carving, Chinese Seal With Your Name ",Craft Supplies & Tools,69.99,0,0,0,0,11,0,"Custom Seal,Personal Seal,Dragon Carving,Personalized Seal,Seal Cutting,Chinese Culture,Custom Chinese Seal,Custom Chinese Chop,Personal Name Seal,Stone Seal Stamp,Personal Name Stamp,Character Chop,Personalized Chops,Gifts for Friends,Personalized Gifts,Gifts",United States,2022-01-14,False,False,False,SindyJoyiArts,https://www.etsy.com/listing/1145523130/chinese-wood-and-brass-chop-seal-chinese,Upgrade Pro to Unlock
"Chinese Laos stone Stone Seal, Personal Name Stamp,Custom Chinese Chop Free Chinese Name Translation Seal. ",Craft Supplies & Tools,35.99,0,0,0,0,7,0,"Name Seal,Custom Seal,Personalized Seal,Personal Seal,Dragon Carving,Chinese Culture,Painting,Calligraphy Brush,Asian Decor,Brush Set,Stone Seal Stamp,Personal Name Stamp,Calligraphy Seal,Personalized Gifts",United States,2022-01-06,False,False,False,SealCuttingArts,https://www.etsy.com/listing/1141090082/chinese-laos-stone-stone-seal-personal,Upgrade Pro to Unlock
Oblong Stone Hanko Chinese Seal Handmade Stone Stamp Chop Chisel Carve Name Calligraphy Painting Book Collection Custom Carving E787 ,Craft Supplies & Tools,25,0,0,0,0,4,0,"Birthday,Enrollment,Graduation,Wedding,Engagement,Square,Book,Collection,Cloth,Name Card,Customized,Birthday Gift,Chinese Name,Birthday Gifts,Gifts for Friends,Gifts for Teachers,Personalized Gifts,Gifts",United States,,False,False,False,salientstone,https://www.etsy.com/listing/735219519/oblong-stone-hanko-chinese-seal-handmade,Upgrade Pro to Unlock
Chinese Name Seal Chop Chinese Stamp  Engraving Peach Blossom Stone Square  Personalize With Your Name in Chinese Symbols ,Craft Supplies & Tools,35.99,0,14,0,0,45,0,"Square,Gifts for Friends,Gifts",United States,2019-05-23,False,False,False,SemliCalligraphy,https://www.etsy.com/listing/694655788/chinese-name-seal-chop-chinese-stamp,Upgrade Pro to Unlock
"Chinese  Lucky gourd  Stamp, Personal Name Stamp,Custom Chinese Chop Free Chinese Name Translation Seal. ",Craft Supplies & Tools,38.99,0,0,0,0,5,0,"Name Seal,Custom Seal,Personalized Seal,Personal Seal,Stone Seal Stamp,Personal Name Stamp,Dragon Carving,Chinese Culture,Calligraphy Seal,Painting,Calligraphy Brush,Asian Decor,Brush Set,Personalized Gifts",United States,,False,False,False,SealCuttingArts,https://www.etsy.com/listing/1367286475/chinese-lucky-gourd-stamp-personal-name,Upgrade Pro to Unlock
"Chinese Xiaoshan red stone Seal, Personal Name Stamp,Custom Chinese Chop Free Chinese Name Translation Seal. ",Craft Supplies & Tools,29.99,0,0,0,0,9,0,"Name Seal,Custom Seal,Personalized Seal,Personal Seal,Stone Seal Stamp,Personal Name Stamp,Dragon Carving,Chinese Culture,Calligraphy Seal,Painting,Calligraphy Brush,Asian Decor,Brush Set,Personalized Gifts",United States,2020-10-19,False,False,False,SealCuttingArts,https://www.etsy.com/listing/875168628/chinese-xiaoshan-red-stone-seal-personal,Upgrade Pro to Unlock
1 pieces of oblong Chinese seal stone stamp chisel carving Carve Name chop for calligraphy painting Yin imprint kanji hanko E174 ,Craft Supplies & Tools,30,0,1,0,0,11,0,"Birthday,Enrollment,Graduation,Wedding,Engagement,Teacher,Colleague,Boss,Classmate,Cloth,Canvas,Name Card,Calligraphy,Birthday Gifts,Gifts for Friends,Gifts for Teachers,Personalized Gifts",United States,,False,False,False,salientstone,https://www.etsy.com/listing/685932963/1-pieces-of-oblong-chinese-seal-stone,Upgrade Pro to Unlock
2 Pieces of Chinese Seal Agate Stone Necklace Pendant Stamp Keychain String Custom Carve Name Chop Calligraphy Painting birthday gift E451 ,Craft Supplies & Tools,30,0,0,0,0,3,0,"Birthday,Graduation,Wedding,Engagement,Name Card,Calligraphy,Printing,Signature,Book,Boss,Classmate,Enrollment,Anti-fake,Birthday Gifts,Gifts for Friends,Gifts for Teachers,Personalized Gifts,Gifts",United States,,False,False,False,salientstone,https://www.etsy.com/listing/696057341/2-pieces-of-chinese-seal-agate-stone,Upgrade Pro to Unlock
Oval Jade Stone Chinese Seal Handmade Stone Stamp Chop Chisel Carve Name Calligraphy Painting Book Collection Custom Carving E443 ,Craft Supplies & Tools,30,0,1,0,0,11,0,"Chinese Name,Stone Chop,Stone Stamp,Graduation,Wedding,Engagement,Calligraphy,Printing,Signature,Book,Mother,Enrollment,Anti-fake,Gifts for Friends,Gifts for Teachers,Personalized Gifts",United States,,False,False,False,salientstone,https://www.etsy.com/listing/695515889/oval-jade-stone-chinese-seal-handmade,Upgrade Pro to Unlock
"Custom Chinese Name Seal,Custom Japanese Name Chop Free Chinese Name Translation Stamp(various patten) ",Craft Supplies & Tools,37.99,0,0,0,0,0,0,"Name Seal,Custom Seal,Personalized Seal,Personal Seal,Stone Seal Stamp,Personal Name Stamp,Dragon Carving,Chinese Culture,Calligraphy Seal,Painting,Calligraphy Brush,Asian Decor,Brush Set,Personalized Gifts",United States,,False,False,False,SealCuttingArts,https://www.etsy.com/listing/1129892931/custom-chinese-name-sealcustom-japanese,Upgrade Pro to Unlock
"Custom Chinese Name Seal,Custom Japanese Name Chop Free Chinese Name Translation Stamp. ",Craft Supplies & Tools,34.99,0,0,0,0,2,0,"Name Seal,Custom Seal,Personalized Seal,Personal Seal,Stone Seal Stamp,Personal Name Stamp,Dragon Carving,Chinese Culture,Calligraphy Seal,Painting,Calligraphy Brush,Asian Decor,Brush Set,Personalized Gifts",United States,2021-11-28,False,False,False,SealCuttingArts,https://www.etsy.com/listing/1115929022/custom-chinese-name-sealcustom-japanese,Upgrade Pro to Unlock
"Custom  Name Seal, Stone Seal Carving, Chinese Stone Square Seal With Your Name Hand Engraved, Custom Made Seal Set ",Craft Supplies & Tools,31.99,0,1,0,0,7,0,"Custom Chinese Chop,Custom Seal,Stone Seal Stamp,Personal Name Stamp,Dragon Carving,Seal Cutting,Chinese Culture,Calligraphy Seal,Personalized Seal,Custom Chinese Seal,Personal Name Seal,Character Chop,Personalized Chops,Gifts for Friends,Personalized Gifts,Gifts",United States,2022-05-17,False,False,False,SindyJoyiArts,https://www.etsy.com/listing/1234544481/custom-name-seal-stone-seal-carving,Upgrade Pro to Unlock
Chinese Character Fonts Stone Seal - 2cm Stamp Chop (Michael / Linda / Paul) ,Craft Supplies & Tools,23,0,6,0,0,18,0,"Stone Seal,Seal,Stamp,Chop,Chinese,Free Shipping,Stone Engraving,Michael,Chinese Character,Chinese Painting,Name,Chinese Fonts",China,2019-04-06,False,False,False,MyLittleHand,https://www.etsy.com/listing/202633881/chinese-character-fonts-stone-seal-2cm,Upgrade Pro to Unlock
Have Your Name Engraved on a Chinese Dragon Stone Seal / White Square / 1.5 X 1.5 CM / Chinese Calligraphy Chop / Personal Name Carving ,Craft Supplies & Tools,29.95,0,105,20,0,267,0,"Chinese Souvenir,Calligraphy Stamp,Calligraphy Seal,Stone Seal Stamp,Chinese Name Stamp,Name Engraving,Chinese Culture Gift,Calligraphy Chop,Chinese Artist Gift,Asian Artist Gift,Chinese Dragon Seal,Square Seal Stamp,White Seal Carving,Gifts",United States,2020-02-20,False,False,False,CalligraphyforGod,https://www.etsy.com/listing/674814969/have-your-name-engraved-on-a-chinese,Upgrade Pro to Unlock
"Custom Asian Name Stamp,Chinese Wood Chop Seal, Personalized Name Seal wood Seal, Custom Janpaness name wood Seal with Your Name, Name Stamp ",Craft Supplies & Tools,19,0,2,0,0,2,0,"Stamp Bag,Wood Seal,Stamp Name,Japanese Name Stamp,Handcrafted Bag,Custom,Custom Asian Stamp,Custom Wood Seal,Chinese Wood Seal,Personalized Gifts,Gifts",United States,,False,False,False,NineColorHAN,https://www.etsy.com/listing/1434725974/custom-asian-name-stampchinese-wood-chop,Upgrade Pro to Unlock
"Chinese Turtle Seal,Chinese Calligraphy Seal, Personal Name Stamp,Custom Chinese Chop Free Chinese Name Translation Seal. ",Craft Supplies & Tools,33.99,0,0,0,0,7,0,"Name Seal,Custom Seal,Personalized Seal,Personal Seal,Personal Name Stamp,Dragon Carving,Chinese Culture,Painting,Calligraphy Brush,Asian Decor,Brush Set,Stone Seal Stamp,Calligraphy Seal,Personalized Gifts,Gifts",United States,2022-05-01,False,False,False,SealCuttingArts,https://www.etsy.com/listing/1211294298/chinese-turtle-sealchinese-calligraphy,Upgrade Pro to Unlock
"Chinese Name Seal, Chinese custom Seal Carving, Chinese Seal With Your Name set Wood Gift box for Painting Calligraphy ",Craft Supplies & Tools,24.99,0,30,5,0,82,0,"Custom Chinese Seal,Custom Seal,Personal Seal,Personal Name Stamp,Character Chop,Dragon Carving,Personalized Seal,Seal Cutting,Chinese Culture,Custom Chinese Chop,Personal Name Seal,Stone Seal Stamp,Personalized Chops,Gifts for Friends,Personalized Gifts,Gifts",United States,2019-11-09,False,False,False,SindyJoyiArts,https://www.etsy.com/listing/751575961/chinese-name-seal-chinese-custom-seal,Upgrade Pro to Unlock
Chinese Stone Seal - The Goddess of the Moon Stamp Chop w/. Gift Box ~1.5 x 4.5cm ,Craft Supplies & Tools,24.99,0,7,0,0,34,0,"Stone Seal,Seal,Stamp,Chop,Chinese,Free Shipping,Goddess of the Moon,Chinese God,Moon,Chinese Festival,Mid-autumn Festival,Mid-autumn,Gifts",China,2015-07-29,False,False,False,MyLittleHand,https://www.etsy.com/listing/242237500/chinese-stone-seal-the-goddess-of-the,Upgrade Pro to Unlock
Green Chinese Name Stamp / With Ink Paste And Wooden Box / Free Name Translation / Hand Engraved Chinese Symbols / Ancient Seal Script ,Art & Collectibles,33.99,0,37,7,0,123,0,"Chinese Chop Seal,Customized Seal,Asian Graduation,Oriental Name Stamp,Chop Seal Stamp,Personal Name Seal,Asian Gift Idea,Name Seal Carving,Chinese Seal for Boy,Name Seal for Man,Green Chinese Stamp,Chinese Chop Grean,Name Seal Chop,Gifts for Boys,Personalized Gifts,Gifts",United States,2021-08-04,False,False,False,CalligraphyforGod,https://www.etsy.com/listing/915376939/green-chinese-name-stamp-with-ink-paste,Upgrade Pro to Unlock
Japanese Hanko Chop Customized Englis Stamp Chinese Name Stamp Custom Wood Stamp Japanese Stationery Chinese Name Seal Wood Name Seal ,Craft Supplies & Tools,33.99,0,22,11,0,132,1,"Chinese Stamp,Personalized Stamp,Japanese Name Stamp,Brass Stamp,Japanese Hanko Chop,Custom Brass Seal,Chinese Art Seal,Gifts for Friends,Personalized Gifts",United States,2021-07-28,False,False,False,SemliCalligraphy,https://www.etsy.com/listing/1020477086/japanese-hanko-chop-customized-englis,Upgrade Pro to Unlock
Brass Stamp Custom Metal Stamp Personal Chinese Name Stamp Chinese Symbol Chinese Art Seal for Calligraphy and Sumi Painting ,Craft Supplies & Tools,30.59,0,42,8,0,135,0,"Brass Stamp,Chinese Seal,Custom Name Stamp,Signet,Chinese Name Stamp,Custom Brass Stamp,Metal Stamp,Metal Seal,Private Seal,Private Chop,Chinese Art Seal,Gifts for Friends,Personalized Gifts,Gifts",United States,2021-06-15,False,False,False,SemliCalligraphy,https://www.etsy.com/listing/1036447133/brass-stamp-custom-metal-stamp-personal,Upgrade Pro to Unlock
Rectangle Chinese Name Chop Chinese Stamp Custom Wood Stamp Stationery Chinese Name Seal ,Craft Supplies & Tools,25.99,0,50,11,0,179,2,Personalized Gifts,United States,2022-08-02,False,False,False,SemliCalligraphy,https://www.etsy.com/listing/1264762052/rectangle-chinese-name-chop-chinese,Upgrade Pro to Unlock
Chinese Name Stamp Seal / Chinese Calligraphy Artist Chop / Red Guardian Beast Square / Custom Engraved With Your Name / 2.5 CM Square ,Art & Collectibles,26.99,0,53,9,0,173,0,"Chinese Name Seal,Chinese Name Stamp,Chinese Culture,Chinese Calligraphy,Chinese Painting,Asian Calligraphy,Chinese Name Chop,Custom Name Seal,Chinese Symbols,Chinese Letters,Chinese Writing,Stone Seal Carving,Custom Made Seal Set,Personalized Gifts",United States,2020-10-29,False,False,False,CalligraphyforGod,https://www.etsy.com/listing/777790594/chinese-name-stamp-seal-chinese,Upgrade Pro to Unlock
"Chinese Peach Resin Sandal wood Chop Seal, Chinese Custom Name Seal, Chinese  Seal Carving, Chinese  Square Seal With Your Name Engraved. ",Craft Supplies & Tools,35.99,0,9,0,0,33,0,"Custom Chinese Seal,Custom Seal,Personal Seal,Personal Name Stamp,Character Chop,Dragon Carving,Personalized Seal,Seal Cutting,Chinese Culture,Custom Chinese Chop,Personal Name Seal,Stone Seal Stamp,Personalized Chops,Gifts for Friends,Personalized Gifts,Gifts",United States,,False,False,False,SindyJoyiArts,https://www.etsy.com/listing/806137995/chinese-peach-resin-sandal-wood-chop,Upgrade Pro to Unlock
A Piece of Chinese Seal Custom Handmade Stone Stamp by Chisel Customized Name Chop for Calligraphy Painting Janpanese Character Kanji E165 ,Craft Supplies & Tools,38,0,1,0,0,11,0,"Wedding,New Couple,Birthday,Yellow,Stone,Teacher,Imprint,Signature,Book,Collection,Name Card,Blog,Icon,Birthday Gifts,Gifts for Friends,Gifts for Teachers,Personalized Gifts",United States,2019-02-23,False,False,False,salientstone,https://www.etsy.com/listing/685443897/a-piece-of-chinese-seal-custom-handmade,Upgrade Pro to Unlock
"Chinese Shou shan stone button seal,  Chinese custom Seal Carving, Chinese Seal With Your Name  set  Wood Gift box for Painting Calligraphy ",Craft Supplies & Tools,42.99,0,0,0,0,3,0,"Craft Supplies & Tools,Stamps & Seals,Stamps,custom chinese seal,custom chinese chop,custom seal,personal name seal,stone seal stamp,personal name stamp,character chop,personalized chops,dragon carving,seal cutting,Calligraphy seal,Chinese culture,personalized seal",,2021-10-28,False,False,False,SindyJoyiArts,https://www.etsy.com/listing/1096282400/chinese-shou-shan-stone-button-seal,
"Engraved Dragon Chinese Chop, Stone Seal / Stamp, Personalize With Your Name ",Craft Supplies & Tools,27.95,0,399,62,0,439,0,"Chinese Seal,Chinese Chop,Name Seal,Stone Carving,Chinese Stamp,Stone Engraving,Stone Seal,Dragon Seal,Dragon Chop,Chinese Dragon,Chinese Engraving,Seal Engraving,Carved Seal,Personalized Gifts",United States,2019-11-25,False,False,False,CalligraphyforGod,https://www.etsy.com/listing/498471491/engraved-dragon-chinese-chop-stone-seal,Upgrade Pro to Unlock
"Chinese  Ceramic Chop Seal, Chinese custom Seal, Chinese Stone Seal Carving, Chinese Stone Square Seal With Your Name Hand Engraved. ",Craft Supplies & Tools,25.99,0,17,0,0,57,0,"Custom Chinese Seal,Custom Seal,Personal Seal,Name Seal,Personal Name Stamp,Character Chop,Dragon Carving,Personalized Seal,Chinese Culture,Seal Cutting,Custom Chinese Chop,Stone Seal Stamp,Personalized Chops,Gifts for Friends,Personalized Gifts,Gifts",United States,2021-07-11,False,False,False,SindyJoyiArts,https://www.etsy.com/listing/988058668/chinese-ceramic-chop-seal-chinese-custom,Upgrade Pro to Unlock
